task,script,url
Amodal Panoptic Segmentation,The goal of this task is to simultaneously predict the pixel-wise semantic segmentation labels of the visible regions of stuff classes and the instance segmentation labels of both the visible and occluded regions of thing classes.,https://paperswithcode.com/task/amodal-panoptic-segmentation
Animal Action Recognition,"Cross-species (intra-class, inter-class) action recognition",https://paperswithcode.com/task/animal-action-recognition
Animal Pose Estimation,"Animal pose estimation is the task of identifying the pose of an animal.
( Image credit: Using DeepLabCut for 3D markerless pose estimation across species and behaviors )",https://paperswithcode.com/task/animal-pose-estimation
Anxiety Detection,Detect anxiety distress of human beings / animals,https://paperswithcode.com/task/anxiety-detection
Arousal Estimation,This task has no description! Would you like to contribute one?,https://paperswithcode.com/task/arousal-estimation
Atari Games,"The Atari 2600 Games task (and dataset) involves training an agent to achieve high game scores.
( Image credit: Playing Atari with Deep Reinforcement Learning )",https://paperswithcode.com/task/atari-games
Audio Emotion Recognition,This task has no description! Would you like to contribute one?,https://paperswithcode.com/task/audio-emotion-recognition
Audio Generation,"Audio generation (synthesis) is the task of generating raw audio such as speech.
( Image credit: MelNet )",https://paperswithcode.com/task/audio-generation
Audio Source Separation,"Audio Source Separation is the process of separating a mixture (e.g. a pop band recording) into isolated sounds from individual sources (e.g. just the lead vocals).
Source: Model selection for deep audio source separation via clustering analysis",https://paperswithcode.com/task/audio-source-separation
Audio-Visual Active Speaker Detection,Determine if and when each visible person in the video is speaking.,https://paperswithcode.com/task/audio-visual-active-speaker-detection
Audio-visual Question Answering,This task has no description! Would you like to contribute one?,https://paperswithcode.com/task/audio-visual-question-answering
Automatic Speech Recognition (ASR),"Automatic Speech Recognition (ASR) involves converting spoken language into written text. It is designed to transcribe spoken words into text in real-time, allowing people to communicate with computers, mobile devices, and other technology using their voice. The goal of Automatic Speech Recognition is to accurately transcribe speech, taking into account variations in accent, pronunciation, and speaking style, as well as background noise and other factors that can affect speech quality.",https://paperswithcode.com/task/automatic-speech-recognition
Behavioral Malware Detection,This task has no description! Would you like to contribute one?,https://paperswithcode.com/task/behavioral-malware-detection
Binarization,This task has no description! Would you like to contribute one?,https://paperswithcode.com/task/binarization
Blind Image Quality Assessment,This task has no description! Would you like to contribute one?,https://paperswithcode.com/task/blind-image-quality-assessment
Boundary Captioning,"Provided with the timestamp of a boundary inside a video, the machine is required to generate sentences describing the status change at the boundary.",https://paperswithcode.com/task/boundary-captioning
Boundary Grounding,"Provided with a description of a boundary inside a video, the machine is required to locate that boundary in the video.",https://paperswithcode.com/task/boundary-grounding
Box-supervised Instance Segmentation,This task aims to achieve instance segmentation with weakly bounding box annotations.,https://paperswithcode.com/task/box-supervised-instance-segmentation
Breast Cancer Detection,This task has no description! Would you like to contribute one?,https://paperswithcode.com/task/breast-cancer-detection
Breast Tumour Classification,This task has no description! Would you like to contribute one?,https://paperswithcode.com/task/breast-tumour-classification
Camera Auto-Calibration,This task has no description! Would you like to contribute one?,https://paperswithcode.com/task/camera-auto-calibration
Camera shot segmentation,"Camera shot temporal segmentation consists in classifying each video frame according to the type of camera used to record said frame. This task is introduced with the SoccerNet-v2 dataset, where 13 camera classes are considered (main camera, behind the goal, corner camera, etc.).",https://paperswithcode.com/task/camera-shot-segmentation
Change Detection,"Change Detection is a computer vision task that involves detecting changes in an image or video sequence over time. The goal is to identify areas in the image or video that have undergone changes, such as appearance changes, object disappearance or appearance, or even changes in the scene's background.
Image credit: ""A TRANSFORMER-BASED SIAMESE NETWORK FOR CHANGE DETECTION""",https://paperswithcode.com/task/change-detection
Clinical Concept Extraction,"Automatic extraction of clinical named entities such as clinical problems, treatments, tests and anatomical parts from clinical notes.
( Source )",https://paperswithcode.com/task/clinical-concept-extraction
Color Mismatch Correction,Color mismatch correction is the task of transferring color from one view of a stereopair to corresponding areas in another where the colors differ incorrectly.,https://paperswithcode.com/task/color-mismatch-correction
Colorectal Gland Segmentation:,This task has no description! Would you like to contribute one?,https://paperswithcode.com/task/colorectal-gland-segmentation
Colorectal Polyps Characterization,This task has no description! Would you like to contribute one?,https://paperswithcode.com/task/colorectal-polyps-characterization
Colorization,"Colorization is a self-supervision approach that relies on colorization as the pretext task in order to learn image representations.
Source:
Colorful Image Colorization
Read Paper
See Code",https://paperswithcode.com/method/colorization
Composite action recognition,This task has no description! Would you like to contribute one?,https://paperswithcode.com/task/composite-action-recognition
Conditional Image Generation,"Conditional image generation is the task of generating new images from a dataset conditional on their class.
( Image credit: PixelCNN++ )",https://paperswithcode.com/task/conditional-image-generation
Continual Learning,"Continual Learning (also known as Incremental Learning, Life-long Learning) is a concept to learn a model for a large number of tasks sequentially without forgetting knowledge obtained from the preceding tasks, where the data in the old tasks are not available anymore during training new ones.
If not mentioned, the benchmarks here are Task-CL, where task-id is provided on validation.
Source:
Continual Learning by Asymmetric Loss Approximation with Single-Side Overestimation
Three scenarios for continual learning
Lifelong Machine Learning
Continual lifelong learning with neural networks: A review",https://paperswithcode.com/task/continual-learning
Contrastive Learning,,https://paperswithcode.com/method/contrastive-learning
Conversational Response Generation,"Given an input conversation, generate a natural-looking text reply to the last conversation element.
Image credit: DIALOGPT : Large-Scale Generative Pre-training for Conversational Response Generation",https://paperswithcode.com/task/conversational-response-generation
Cross-Modal Retrieval,"Cross-Modal Retrieval is used for implementing a retrieval task across different modalities. such as image-text, video-text, and audio-text Cross-Modal Retrieval. The main challenge of Cross-Modal Retrieval is the modality gap and the key solution of Cross-Modal Retrieval is to generate new representations from different modalities in the shared subspace, such that new generated features can be applied in the computation of distance metrics, such as cosine distance and Euclidean distance.
Source: Deep Triplet Neural Networks with Cluster-CCA for Audio-Visual Cross-modal Retrieval",https://paperswithcode.com/task/cross-modal-retrieval
Data Augmentation,"Data augmentation involves techniques used for increasing the amount of data, based on different modifications, to expand the amount of examples in the original dataset. Data augmentation not only helps to grow the dataset but it also increases the diversity of the dataset. When training machine learning models, data augmentation acts as a regularizer and helps to avoid overfitting.
Data augmentation techniques have been found useful in domains like NLP and computer vision. In computer vision, transformations like cropping, flipping, and rotation are used. In NLP, data augmentation techniques can include swapping, deletion, random insertion, among others.
Further readings:
A Survey of Data Augmentation Approaches for NLP
A survey on Image Data Augmentation for Deep Learning
( Image credit: Albumentations )",https://paperswithcode.com/task/data-augmentation
Deep Attention,This task has no description! Would you like to contribute one?,https://paperswithcode.com/task/deep-attention
Depression Detection,"Depression Detection is the problem of identifying signs of depression in individuals. These signs might be identified in peoples’ speech, facial expressions and in the use of language.
Source: Affective Conditioning on Hierarchical Attention Networks applied to Depression Detection from Transcribed Clinical Interviews",https://paperswithcode.com/task/depression-detection
Dialog Act Classification,This task has no description! Would you like to contribute one?,https://paperswithcode.com/task/dialog-act-classification
Dialogue Generation,"Dialogue generation is the task of ""understanding"" natural language inputs - within natural language processing in order to produce output. The systems are usually intended for conversing with humans, for instance back and forth dialogue with a conversation agent like a chatbot. Some example benchmarks for this task (see others such as Natural Language Understanding) include FusedChat and Ubuntu DIalogue Corpus (UDC). Models can be evaluated via metrics such as BLEU, ROUGE, and METEOR albeit with challenges in terms of weak correlation with human judgement, that may be addressed by new ones like UnSupervised and Reference-free (USR) and Metric for automatic Unreferenced dialog evaluation (MaUde).",https://paperswithcode.com/task/dialogue-generation
Dimensionality Reduction,Dimensionality Reduction methods transform data from a high-dimensional space into a low-dimensional space so that the low-dimensional space retains the most important properties of the original data. Below you can find a continuously updating list of dimensionality reduction methods.,https://paperswithcode.com/methods/category/dimensionality-reduction
Drivable Area Detection,This task has no description! Would you like to contribute one?,https://paperswithcode.com/task/drivable-area-detection
Emotional Dialogue Acts,"Associating Emotions and Dialogue Acts to find unique relationships between them such as Accept/Agree dialogue acts often occur with the Joy emotion, Apology with Sadness, or Thanking with Joy. First introduced in the paper EDA: Enriching Emotional Dialogue Acts using an Ensemble of Neural Annotators, LREC 2020 (https://aclanthology.org/2020.lrec-1.78/).",https://paperswithcode.com/task/emotional-dialogue-acts
English Conversational Speech Recognition,This task has no description! Would you like to contribute one?,https://paperswithcode.com/task/english-conversational-speech-recognition
Face Clustering,Face Clustering in the videos,https://paperswithcode.com/task/face-clustering
Face Generation,"Face generation is the task of generating (or interpolating) new faces from an existing dataset.
The state-of-the-art results for this task are located in the Image Generation parent.
( Image credit: Progressive Growing of GANs for Improved Quality, Stability, and Variation )",https://paperswithcode.com/task/face-generation
Facial Expression Translation,This task has no description! Would you like to contribute one?,https://paperswithcode.com/task/facial-expression-translation
Facial expression generation,This task has no description! Would you like to contribute one?,https://paperswithcode.com/task/facial-expression-generation
Fact Checking,This task has no description! Would you like to contribute one?,https://paperswithcode.com/task/fact-checking
Few-Shot Image Classification,"Few-Shot Image Classification is a computer vision task that involves training machine learning models to classify images into predefined categories using only a few labeled examples of each category (typically < 6 examples). The goal is to enable models to recognize and classify new images with minimal supervision and limited data, without having to train on large datasets. (typically < 6 examples)
( Image credit: Learning Embedding Adaptation for Few-Shot Learning )",https://paperswithcode.com/task/few-shot-image-classification
Few-Shot Object Detection,Few-Shot Object Detection is a computer vision task that involves detecting objects in images with limited training data. The goal is to train a model on a few examples of each object class and then use the model to detect objects in new images.,https://paperswithcode.com/task/few-shot-object-detection
Fill Mask,This task has no description! Would you like to contribute one?,https://paperswithcode.com/task/fill-mask
Fine-Grained Vehicle Classification,This task has no description! Would you like to contribute one?,https://paperswithcode.com/task/fine-grained-vehicle-classification
Fine-Grained Visual Categorization,This task has no description! Would you like to contribute one?,https://paperswithcode.com/task/fine-grained-visual-categorization
Fine-Grained Visual Recognition,This task has no description! Would you like to contribute one?,https://paperswithcode.com/task/fine-grained-visual-recognition
Fine-grained Action Recognition,This task has no description! Would you like to contribute one?,https://paperswithcode.com/task/fine-grained-action-recognition
Fire Detection,Detection of fire using multi-variate time series sensor data.,https://paperswithcode.com/task/fire-detection
Future Hand Prediction,This task has no description! Would you like to contribute one?,https://paperswithcode.com/task/future-hand-prediction
Future prediction,This task has no description! Would you like to contribute one?,https://paperswithcode.com/task/future-prediction
Gait Identification,This task has no description! Would you like to contribute one?,https://paperswithcode.com/task/gait-identification
Gaze Prediction,This task has no description! Would you like to contribute one?,https://paperswithcode.com/task/eye-tracking
Gender Prediction,This task has no description! Would you like to contribute one?,https://paperswithcode.com/task/gender-prediction
General Action Video Anomaly Detection,Detecting if an entire short clip of a any action features an anomalous motion - another action class not seen during training.,https://paperswithcode.com/task/general-action-video-anomaly-detection
General Classification,Algorithms trying to solve the general task of classification.,https://paperswithcode.com/task/classification
Generalizable Person Re-identification,Generalizable person re-identification refers to methods trained on a source dataset but directly evaluated on a target dataset without domain adaptation or transfer learning.,https://paperswithcode.com/task/generalizable-person-re-identification
Generalized Zero-Shot Object Detection,This task has no description! Would you like to contribute one?,https://paperswithcode.com/task/generalized-zero-shot-object-detection
Gesture Generation,"Generation of gestures, as a sequence of 3d poses",https://paperswithcode.com/task/gesture-generation
Graph Matching,"Graph Matching is the problem of finding correspondences between two sets of vertices while preserving complex relational information among them. Since the graph structure has a strong capacity to represent objects and robustness to severe deformation and outliers, it is frequently adopted to formulate various correspondence problems in the field of computer vision. Theoretically, the Graph Matching problem can be solved by exhaustively searching the entire solution space. However, this approach is infeasible in practice because the solution space expands exponentially as the size of input data increases. For that reason, previous studies have attempted to solve the problem by using various approximation techniques.
Source: Consistent Multiple Graph Matching with Multi-layer Random Walks Synchronization",https://paperswithcode.com/task/graph-matching
Group Anomaly Detection,This task has no description! Would you like to contribute one?,https://paperswithcode.com/task/group-anomaly-detection
HD semantic map learning,"The goal of task is to generate map elements in a vectorized form using data from onboard sensors, e.g., RGB cameras and/or LiDARs. These map elements include but are not limited to : Road boundaries, boundaries of roads that split roads and sidewalks.",https://paperswithcode.com/task/hd-semantic-map-learning
HDR Reconstruction,This task has no description! Would you like to contribute one?,https://paperswithcode.com/task/hdr-reconstruction
Hand Joint Reconstruction,This task has no description! Would you like to contribute one?,https://paperswithcode.com/task/hand-joint-reconstruction
Hand Segmentation,This task has no description! Would you like to contribute one?,https://paperswithcode.com/task/hand-segmentation
Hand-Gesture Recognition,This task has no description! Would you like to contribute one?,https://paperswithcode.com/task/hand-gesture-recognition-1
Head Pose Estimation,"Estimating the head pose of a person is a crucial problem that has a large amount of applications such as aiding in gaze estimation, modeling attention, fitting 3D models to video and performing face alignment.
( Image credit: FSA-Net: Learning Fine-Grained Structure Aggregation for Head Pose Estimation from a Single Image )",https://paperswithcode.com/task/head-pose-estimation
Heart Rate Variability,Heart rate variability (HRV) is the physiological phenomenon of variation in the time interval between heartbeats. It is measured by the variation in the beat-to-beat interval.,https://paperswithcode.com/task/heart-rate-variability
Home Activity Monitoring,This task has no description! Would you like to contribute one?,https://paperswithcode.com/task/home-activity-monitoring
Human Activity Recognition,Classify various human activities,https://paperswithcode.com/task/human-activity-recognition
Human Dynamics,This task has no description! Would you like to contribute one?,https://paperswithcode.com/task/human-dynamics
Human Instance Segmentation,"Instance segmentation is the task of detecting and delineating each distinct object of interest appearing in an image.
Image Credit: Deep Occlusion-Aware Instance Segmentation with Overlapping BiLayers",https://paperswithcode.com/task/human-instance-segmentation
Human Part Segmentation,This task has no description! Would you like to contribute one?,https://paperswithcode.com/task/human-part-segmentation
Human fMRI response prediction,"The task is: Given a) the set of videos of everyday events and b) the corresponding brain responses recorded while human participants viewed those videos, use computational models to predict brain responses for videos.",https://paperswithcode.com/task/human-fmri-response-prediction
Human motion prediction,"Action prediction is a pre-fact video understanding task, which focuses on future states, in other words, it needs to reason about future states or infer action labels before the end of action execution.",https://paperswithcode.com/task/human-motion-prediction
Human-Object-interaction motion tracking,This task has no description! Would you like to contribute one?,https://paperswithcode.com/task/human-object-interaction-motion-tracking
Image Captioning,"Image Captioning is the task of describing the content of an image in words. This task lies at the intersection of computer vision and natural language processing. Most image captioning systems use an encoder-decoder framework, where an input image is encoded into an intermediate representation of the information in the image, and then decoded into a descriptive text sequence. The most popular benchmarks are nocaps and COCO, and models are typically evaluated according to a BLEU or CIDER metric.
( Image credit: Reflective Decoding Network for Image Captioning, ICCV'19)",https://paperswithcode.com/task/image-captioning
Image Deblurring,This task has no description! Would you like to contribute one?,https://paperswithcode.com/task/image-deblurring
Image Dehazing,( Image credit: Densely Connected Pyramid Dehazing Network ),https://paperswithcode.com/task/image-dehazing
Image Denoising,"Image Denoising is a computer vision task that involves removing noise from an image. Noise can be introduced into an image during acquisition or processing, and can reduce image quality and make it difficult to interpret. Image denoising techniques aim to restore an image to its original quality by reducing or removing the noise, while preserving the important features of the image.
( Image credit: Wide Inference Network for Image Denoising via Learning Pixel-distribution Prior )",https://paperswithcode.com/task/image-denoising
Image Generation from Scene Graphs,This task has no description! Would you like to contribute one?,https://paperswithcode.com/task/image-generation-from-scene-graphs
Image Manipulation,This task has no description! Would you like to contribute one?,https://paperswithcode.com/task/image-manipulation
Image Registration,"Image registration is the process of transforming different sets of data into one coordinate system. Data may be multiple photographs, data from different sensors, times, depths, or viewpoints. It is used in computer vision, medical imaging, and compiling and analyzing images and data from satellites. Registration is necessary in order to be able to compare or integrate the data obtained from these different measurements.
Source: Image registration | Wikipedia
( Image credit: Kornia )",https://paperswithcode.com/task/image-registration
Image Relighting,Image relighting involves changing the illumination settings of an image.,https://paperswithcode.com/task/image-relighting
Image Restoration,"Image Restoration is a family of inverse problems for obtaining a high quality image from a corrupted input image. Corruption may occur due to the image-capture process (e.g., noise, lens blur), post-processing (e.g., JPEG compression), or photography in non-ideal conditions (e.g., haze, motion blur).
Source: Blind Image Restoration without Prior Knowledge",https://paperswithcode.com/task/image-restoration
Image-level Supervised Instance Segmentation,Weakly-Supervised Instance Segmentation using Image-level Labels,https://paperswithcode.com/task/image-level-supervised-instance-segmentation
Image-to-Text Retrieval,This task has no description! Would you like to contribute one?,https://paperswithcode.com/task/image-to-text-retrieval
Imitation Learning,"Imitation Learning is a framework for learning a behavior policy from demonstrations. Usually, demonstrations are presented in the form of state-action trajectories, with each pair indicating the action to take at the state being visited. In order to learn the behavior policy, the demonstrated actions are usually utilized in two ways. The first, known as Behavior Cloning (BC), treats the action as the target label for each state, and then learns a generalized mapping from states to actions in a supervised manner. Another way, known as Inverse Reinforcement Learning (IRL), views the demonstrated actions as a sequence of decisions, and aims at finding a reward/cost function under which the demonstrated decisions are optimal.
Finally, a newer methodology, Inverse Q-Learning aims at directly learning Q-functions from expert data, implicitly representing rewards, under which the optimal policy can be given as a Boltzmann distribution similar to soft Q-learning
Source: Learning to Imitate",https://paperswithcode.com/task/imitation-learning
Imputation,Substituting missing data with values according to some criteria.,https://paperswithcode.com/task/imputation
Indoor Localization,Indoor localization is a fundamental problem in indoor location-based applications.,https://paperswithcode.com/task/indoor-localization
Information Retrieval,"Information retrieval is the task of ranking a list of documents or search results in response to a query
( Image credit: sudhanshumittal )",https://paperswithcode.com/task/information-retrieval
Instrument Recognition,This task has no description! Would you like to contribute one?,https://paperswithcode.com/task/instrument-recognition
Inverse-Tone-Mapping,This task has no description! Would you like to contribute one?,https://paperswithcode.com/task/inverse-tone-mapping-1
Joint Demosaicing and Denoising,This task has no description! Would you like to contribute one?,https://paperswithcode.com/task/joint-demosaicing-and-denoising
Keypoint Detection,"Keypoint Detection involves simultaneously detecting people and localizing their keypoints. Keypoints are the same thing as interest points. They are spatial locations, or points in the image that define what is interesting or what stand out in the image. They are invariant to image rotation, shrinkage, translation, distortion, and so on.
( Image credit: PifPaf: Composite Fields for Human Pose Estimation; ""Learning to surf"" by fotologic, license: CC-BY-2.0 )",https://paperswithcode.com/task/keypoint-detection
