task,script,url
Action Recognition,"Action Recognition is a computer vision task that involves recognizing human actions in videos or images. The goal is to classify and categorize the actions being performed in the video or image into a predefined set of action classes.
In the video domain, it is an open question whether training an action classification network on a sufficiently large dataset, will give a similar boost in performance when applied to a different temporal task or dataset. The challenges of building video datasets has meant that most popular benchmarks for action recognition are small, having on the order of 10k videos.
Please note some benchmarks may be located in the Action Classification or Video Classification tasks, e.g. Kinetics-400.",https://paperswithcode.com/task/action-recognition-in-videos
Temporal Action Localization,Temporal Action Localization aims to detect activities in the video stream and output beginning and end timestamps. It is closely related to Temporal Action Proposal Generation.,https://paperswithcode.com/task/action-recognition
Object Detection,"Object Detection is a computer vision task in which the goal is to detect and locate objects of interest in an image or video. The task involves identifying the position and boundaries of objects in an image, and classifying the objects into different categories.
The state-of-the-art methods can be categorized into two main types: one-stage methods and two stage-methods:
One-stage methods prioritize inference speed, and example models include YOLO, SSD and RetinaNet.
Two-stage methods prioritize detection accuracy, and example models include Faster R-CNN, Mask R-CNN and Cascade R-CNN.
The most popular benchmark is the MSCOCO dataset. Models are typically evaluated according to a Mean Average Precision metric.
( Image credit: Detectron )",https://paperswithcode.com/task/object-detection
Object Tracking,"Object tracking is the task of taking an initial set of object detections, creating a unique ID for each of the initial detections, and then tracking each of the objects as they move around frames in a video, maintaining the ID assignment. State-of-the-art methods involve fusing data from RGB and event-based cameras to produce more reliable object tracking. CNN-based models using only RGB images as input are also effective. The most popular benchmark is OTB. There are several evaluation metrics specific to object tracking, including HOTA, MOTA, IDF1, and Track-mAP.
( Image credit: Towards-Realtime-MOT )",https://paperswithcode.com/task/object-tracking
Video Understanding,"A crucial task of Video Understanding is to recognise and localise (in space and time) different actions or events appearing in the video.
Source: Action Detection from a Robot-Car Perspective",https://paperswithcode.com/task/video-understanding
Pose Estimation,"Pose Estimation is a computer vision task where the goal is to detect the position and orientation of a person or an object. Usually, this is done by predicting the location of specific keypoints like hands, head, elbows, etc. in case of Human Pose Estimation.
A common benchmark for this task is MPII Human Pose
( Image credit: Real-time 2D Multi-Person Pose Estimation on CPU: Lightweight OpenPose )",https://paperswithcode.com/task/pose-estimation
Video Question Answering,"Video Question Answering (VideoQA) aims to answer natural language questions according to the given videos. Given a video and a question in natural language, the model produces accurate answers according to the content of the video.",https://paperswithcode.com/task/video-question-answering
Video Retrieval,"The objective of video retrieval is as follows: given a text query and a pool of candidate videos, select the video which corresponds to the text query. Typically, the videos are returned as a ranked list of candidates and scored via document retrieval metrics.",https://paperswithcode.com/task/video-retrieval
Multi-Object Tracking,"Multi-Object Tracking is a task in computer vision that involves detecting and tracking multiple objects within a video sequence. The goal is to identify and locate objects of interest in each frame and then associate them across frames to keep track of their movements over time. This task is challenging due to factors such as occlusion, motion blur, and changes in object appearance, and is typically solved using algorithms that integrate object detection and data association techniques.",https://paperswithcode.com/task/multi-object-tracking
Video Captioning,"Video Captioning is a task of automatic captioning a video by understanding the action and event in the video which can help in the retrieval of the video efficiently through text.
Source: NITS-VC System for VATEX Video Captioning Challenge 2020",https://paperswithcode.com/task/video-captioning
Action Classification,Image source: The Kinetics Human Action Video Dataset,https://paperswithcode.com/task/action-classification
Action Detection,This task has no description! Would you like to contribute one?,https://paperswithcode.com/task/action-detection
Semantic Segmentation,"Semantic Segmentation is a computer vision task in which the goal is to categorize each pixel in an image into a class or object. The goal is to produce a dense pixel-wise segmentation map of an image, where each pixel is assigned to a specific class or object. Some example benchmarks for this task are Cityscapes, PASCAL VOC and ADE20K. Models are usually evaluated with the Mean Intersection-Over-Union (Mean IoU) and Pixel Accuracy metrics.
( Image credit: CSAILVision )",https://paperswithcode.com/task/semantic-segmentation
Question Answering,"Question Answering is the task of answering questions (typically reading comprehension questions), but abstaining when presented with a question that cannot be answered based on the provided context.
Question answering can be segmented into domain-specific tasks like community question answering and knowledge-base question answering. Popular benchmark datasets for evaluation question answering systems include SQuAD, HotPotQA, bAbI, TriviaQA, WikiQA, and many others. Models for question answering are typically evaluated on metrics like EM and F1. Some recent top performing models are T5 and XLNet.
( Image credit: SQuAD )",https://paperswithcode.com/task/question-answering
Visual Question Answering (VQA),"Visual Question Answering (VQA) is a task in computer vision that involves answering questions about an image. The goal of VQA is to teach machines to understand the content of an image and answer questions about it in natural language.
Image Source: visualqa.org",https://paperswithcode.com/task/visual-question-answering
Action Recognition In Videos,"Action Recognition in Videos is a task in computer vision and pattern recognition where the goal is to identify and categorize human actions performed in a video sequence. The task involves analyzing the spatiotemporal dynamics of the actions and mapping them to a predefined set of action classes, such as running, jumping, or swimming.",https://paperswithcode.com/task/action-recognition-in-videos-2
Activity Recognition,"Human Activity Recognition is the problem of identifying events performed by humans given a video input. It is formulated as a binary (or multiclass) classification problem of outputting activity class labels. Activity Recognition is an important problem with many societal applications including smart surveillance, video search/retrieval, intelligent robots, and other monitoring systems.
Source: Learning Latent Sub-events in Activity Videos Using Temporal Attention Filters",https://paperswithcode.com/task/activity-recognition
Video Prediction,"Video Prediction is the task of predicting future frames given past video frames.
Gif credit: MAGVIT
Source: Photo-Realistic Video Prediction on Natural Videos of Largely Changing Frames",https://paperswithcode.com/task/video-prediction
Visual Object Tracking,"Visual Object Tracking is an important research topic in computer vision, image understanding and pattern recognition. Given the initial state (centre location and scale) of a target in the first frame of a video sequence, the aim of Visual Object Tracking is to automatically obtain the states of the object in the subsequent video frames.
Source: Learning Adaptive Discriminative Correlation Filters via Temporal Consistency Preserving Spatial Feature Selection for Robust Visual Object Tracking",https://paperswithcode.com/task/visual-object-tracking
Skeleton Based Action Recognition,"Skeleton-based Action Recognition is a computer vision task that involves recognizing human actions from a sequence of 3D skeletal joint data captured from sensors such as Microsoft Kinect, Intel RealSense, and wearable devices. The goal of skeleton-based action recognition is to develop algorithms that can understand and classify human actions from skeleton data, which can be used in various applications such as human-computer interaction, sports analysis, and surveillance.
( Image credit: View Adaptive Neural Networks for High Performance Skeleton-based Human Action Recognition )",https://paperswithcode.com/task/skeleton-based-action-recognition
Speech Recognition,,https://paperswithcode.com/methods/category/speech-recognition
Video Classification,"Video Classification is the task of producing a label that is relevant to the video given its frames. A good video level classifier is one that not only provides accurate frame labels, but also best describes the entire video given the features and the annotations of the various frames in the video. For example, a video might contain a tree in some frame, but the label that is central to the video might be something else (e.g., “hiking”). The granularity of the labels that are needed to describe the frames and the video depends on the task. Typical tasks include assigning one or more global labels to the video, and assigning one or more labels for each frame inside the video.
Source: Efficient Large Scale Video Classification",https://paperswithcode.com/task/video-classification
Video Object Segmentation,"Video object segmentation is a binary labeling problem aiming to separate foreground object(s) from the background region of a video.
For leaderboards please refer to the different subtasks.",https://paperswithcode.com/task/video-object-segmentation
Visual Tracking,"Visual Tracking is an essential and actively researched problem in the field of computer vision with various real-world applications such as robotic services, smart surveillance systems, autonomous driving, and human-computer interaction. It refers to the automatic estimation of the trajectory of an arbitrary target object, usually specified by a bounding box in the first frame, as it moves around in subsequent video frames.
Source: Learning Reinforced Attentional Representation for End-to-End Visual Tracking",https://paperswithcode.com/task/visual-tracking
DeepFake Detection,"DeepFake Detection is the task of detecting fake videos or images that have been generated using deep learning techniques. Deepfakes are created by using machine learning algorithms to manipulate or replace parts of an original video or image, such as the face of a person. The goal of deepfake detection is to identify such manipulations and distinguish them from real videos or images.
Description source: DeepFakes: a New Threat to Face Recognition? Assessment and Detection
Image source: DeepFakes: a New Threat to Face Recognition? Assessment and Detection",https://paperswithcode.com/task/deepfake-detection
Person Re-Identification,"Person Re-Identification is a computer vision task in which the goal is to match a person's identity across different cameras or locations in a video or image sequence. It involves detecting and tracking a person and then using features such as appearance, body shape, and clothing to match their identity in different frames. The goal is to associate the same person across multiple non-overlapping camera views in a robust and efficient manner.",https://paperswithcode.com/task/person-re-identification
Facial Expression Recognition (FER),"Facial Expression Recognition (FER) is a computer vision task aimed at identifying and categorizing emotional expressions depicted on a human face. The goal is to automate the process of determining emotions in real-time, by analyzing the various features of a face such as eyebrows, eyes, mouth, and other features, and mapping them to a set of emotions such as anger, fear, surprise, sadness and happiness.
( Image credit: DeXpression )",https://paperswithcode.com/task/facial-expression-recognition
3D Human Pose Estimation,"3D Human Pose Estimation is a computer vision task that involves estimating the 3D positions and orientations of body joints and bones from 2D images or videos. The goal is to reconstruct the 3D pose of a person in real-time, which can be used in a variety of applications, such as virtual reality, human-computer interaction, and motion analysis.",https://paperswithcode.com/task/3d-human-pose-estimation
Action Segmentation,"Action Segmentation is a challenging problem in high-level video understanding. In its simplest form, Action Segmentation aims to segment a temporally untrimmed video by time and label each segmented part with one of pre-defined action labels. The results of Action Segmentation can be further used as input to various applications, such as video-to-text and action localization.
Source: TricorNet: A Hybrid Temporal Convolutional and Recurrent Network for Video Action Segmentation",https://paperswithcode.com/task/action-segmentation
Sign Language Recognition,"Sign Language Recognition is a computer vision and natural language processing task that involves automatically recognizing and translating sign language gestures into written or spoken language. The goal of sign language recognition is to develop algorithms that can understand and interpret sign language, enabling people who use sign language as their primary mode of communication to communicate more easily with non-signers.
( Image credit: Word-level Deep Sign Language Recognition from Video: A New Large-scale Dataset and Methods Comparison )",https://paperswithcode.com/task/sign-language-recognition
Trajectory Prediction,"Trajectory Prediction is the problem of predicting the short-term (1-3 seconds) and long-term (3-5 seconds) spatial coordinates of various road-agents such as cars, buses, pedestrians, rickshaws, and animals, etc. These road-agents have different dynamic behaviors that may correspond to aggressive or conservative driving styles.
Source: Forecasting Trajectory and Behavior of Road-Agents Using Spectral Clustering in Graph-LSTMs",https://paperswithcode.com/task/trajectory-prediction
Autonomous Driving,"Autonomous driving is the task of driving a vehicle without human conduction.
Many of the state-of-the-art results can be found at more general task pages such as 3D Object Detection and Semantic Segmentation.
(Image credit: Exploring the Limitations of Behavior Cloning for Autonomous Driving)",https://paperswithcode.com/task/autonomous-driving
Human-Object Interaction Detection,"Human-Object Interaction (HOI) detection is a task of identifying ""a set of interactions"" in an image, which involves the i) localization of the subject (i.e., humans) and target (i.e., objects) of interaction, and ii) the classification of the interaction labels.",https://paperswithcode.com/task/human-object-interaction-detection
Video Summarization,"Video Summarization aims to generate a short synopsis that summarizes the video content by selecting its most informative and important parts. The produced summary is usually composed of a set of representative video frames (a.k.a. video key-frames), or video fragments (a.k.a. video key-fragments) that have been stitched in chronological order to form a shorter video. The former type of a video summary is known as video storyboard, and the latter type is known as video skim.
Source: Video Summarization Using Deep Neural Networks: A Survey
Image credit: iJRASET",https://paperswithcode.com/task/video-summarization
Zero-Shot Learning,"Zero-shot learning (ZSL) is a model's ability to detect classes never seen during training. The condition is that the classes are not known during supervised learning.
Earlier work in zero-shot learning use attributes in a two-step approach to infer unknown classes. In the computer vision context, more recent advances learn mappings from image feature space to semantic space. Other approaches learn non-linear multimodal embeddings. In the modern NLP context, language models can be evaluated on downstream tasks without fine tuning.
Benchmark datasets for zero-shot learning include aPY, AwA, and CUB, among others.
( Image credit: Prototypical Networks for Few shot Learning in PyTorch )
Further readings:
Zero-Shot Learning -- A Comprehensive Evaluation of the Good, the Bad and the Ugly
Zero-Shot Learning in Modern NLP
Zero-Shot Learning for Text Classification",https://paperswithcode.com/task/zero-shot-learning
Activity Detection,Detecting activities in extended videos.,https://paperswithcode.com/task/activity-detection
Anomaly Detection,"Anomaly Detection is a binary classification identifying unusual or unexpected patterns in a dataset, which deviate significantly from the majority of the data. The goal of anomaly detection is to identify such anomalies, which could represent errors, fraud, or other types of unusual events, and flag them for further investigation.
[Image source]: GAN-based Anomaly Detection in Imbalance Problems",https://paperswithcode.com/task/anomaly-detection
Instance Segmentation,"Instance Segmentation is a computer vision task that involves identifying and separating individual objects within an image, including detecting the boundaries of each object and assigning a unique label to each object. The goal of instance segmentation is to produce a pixel-wise segmentation map of the image, where each pixel is assigned to a specific object instance.
Image Credit: Deep Occlusion-Aware Instance Segmentation with Overlapping BiLayers, CVPR'21",https://paperswithcode.com/task/instance-segmentation
Multiple Object Tracking,"Multiple Object Tracking is the problem of automatically identifying multiple objects in a video and representing them as a set of trajectories with high accuracy.
Source: SOT for MOT",https://paperswithcode.com/task/multiple-object-tracking
Optical Flow Estimation,"Optical Flow Estimation is a computer vision task that involves computing the motion of objects in an image or a video sequence. The goal of optical flow estimation is to determine the movement of pixels or features in the image, which can be used for various applications such as object tracking, motion analysis, and video compression.
Approaches for optical flow estimation include correlation-based, block-matching, feature tracking, energy-based, and more recently gradient-based.
Further readings:
Optical Flow Estimation
Performance of Optical Flow Techniques
Definition source: Devon: Deformable Volume Network for Learning Optical Flow
Image credit: Optical Flow Estimation",https://paperswithcode.com/task/optical-flow-estimation
Video Generation,( Various Video Generation Tasks. Gif credit: MaGViT ),https://paperswithcode.com/task/video-generation
Video Segmentation,This task has no description! Would you like to contribute one?,https://paperswithcode.com/task/video-segmentation
3D Action Recognition,Image: Rahmani et al,https://paperswithcode.com/task/3d-human-action-recognition
Ad-hoc video search,"The Ad-hoc search task ended a 3 year cycle from 2016-2018 with a goal to model the end user search use-case, who is searching (using textual sentence queries) for segments of video containing persons, objects, activities, locations, etc. and combinations of the former. While the Internet Archive (IACC.3) dataset was adopted between 2016 to 2018, starting in 2019 a new data collection based on Vimeo Creative Commons (V3C) will be adopted to support the task for at least 3 more years.
Given the test collection (V3C1 or IACC.3), master shot boundary reference, and set of Ad-hoc queries (approx. 30 queries) released by NIST, return for each query a list of at most 1000 shot IDs from the test collection ranked according to their likelihood of containing the target query.",https://paperswithcode.com/task/ad-hoc-video-search
Audio Classification,"Audio Classification is a machine learning task that involves identifying and tagging audio signals into different classes or categories. The goal of audio classification is to enable machines to automatically recognize and distinguish between different types of audio, such as music, speech, and environmental sounds.",https://paperswithcode.com/task/audio-classification
Depth Estimation,"Depth Estimation is the task of measuring the distance of each pixel relative to the camera. Depth is extracted from either monocular (single) or stereo (multiple views of a scene) images. Traditional methods use multi-view geometry to find the relationship between the images. Newer methods can directly estimate depth by minimizing the regression loss, or by learning to generate a novel view from a sequence. The most popular benchmarks are KITTI and NYUv2. Models are typically evaluated according to a RMS metric.
Source: DIODE: A Dense Indoor and Outdoor DEpth Dataset",https://paperswithcode.com/task/depth-estimation
Face Anti-Spoofing,"Facial anti-spoofing is the task of preventing false facial verification by using a photo, video, mask or a different substitute for an authorized person’s face. Some examples of attacks:
Print attack: The attacker uses someone’s photo. The image is printed or displayed on a digital device.
Replay/video attack: A more sophisticated way to trick the system, which usually requires a looped video of a victim’s face. This approach ensures behaviour and facial movements to look more ‘natural’ compared to holding someone’s photo.
3D mask attack: During this type of attack, a mask is used as the tool of choice for spoofing. It’s an even more sophisticated attack than playing a face video. In addition to natural facial movements, it enables ways to deceive some extra layers of protection such as depth sensors.
( Image credit: Learning Generalizable and Identity-Discriminative Representations for Face Anti-Spoofing )",https://paperswithcode.com/task/face-anti-spoofing
Face Recognition,"Facial Recognition is the task of making a positive identification of a face in a photo or video image against a pre-existing database of faces. It begins with detection - distinguishing human faces from other objects in the image - and then works on identification of those detected faces.
The state of the art tables for this task are contained mainly in the consistent parts of the task : the face verification and face identification tasks.
( Image credit: Face Verification )",https://paperswithcode.com/task/face-recognition
Multi-Task Learning,"Multi-task learning aims to learn multiple different tasks simultaneously while maximizing performance on one or all of the tasks.
( Image credit: Cross-stitch Networks for Multi-task Learning )",https://paperswithcode.com/task/multi-task-learning
Self-Supervised Learning,Self-Supervised Learning refers to a category of methods where we learn representations in a self-supervised way (i.e without labels). These methods generally involve a pretext task that is solved to learn a good representation and a loss function to learn with. Below you can find a continuously updating list of self-supervised methods.,https://paperswithcode.com/methods/category/self-supervised-learning
Semi-Supervised Video Object Segmentation,The semi-supervised scenario assumes the user inputs a full mask of the object(s) of interest in the first frame of a video sequence. Methods have to produce the segmentation mask for that object(s) in the subsequent frames.,https://paperswithcode.com/task/semi-supervised-video-object-segmentation
Sign Language Translation,"Given a video containing sign language, the task is to predict the translation into (written) spoken language.
Image credit: How2Sign",https://paperswithcode.com/task/sign-language-translation
Unsupervised Video Object Segmentation,The unsupervised scenario assumes that the user does not interact with the algorithm to obtain the segmentation masks. Methods should provide a set of object candidates with no overlapping pixels that span through the whole video sequence. This set of objects should contain at least the objects that capture human attention when watching the whole video sequence i.e objects that are more likely to be followed by human gaze.,https://paperswithcode.com/task/unsupervised-video-object-segmentation
Video Object Detection,"Video object detection is the task of detecting objects from a video as opposed to images.
( Image credit: Learning Motion Priors for Efficient Video Object Detection )",https://paperswithcode.com/task/video-object-detection
Video Object Tracking,Video Object Detection aims to detect targets in videos using both spatial and temporal information. It's usually deeply integrated with tasks such as Object Detection and Object Tracking.,https://paperswithcode.com/task/video-object-tracking
Video Quality Assessment,This task has no description! Would you like to contribute one?,https://paperswithcode.com/task/video-quality-assessment
