task,script,url
3D Object Detection,"3D Object Detection is a task in computer vision where the goal is to identify and locate objects in a 3D environment based on their shape, location, and orientation. It involves detecting the presence of objects and determining their location in the 3D space in real-time. This task is crucial for applications such as autonomous vehicles, robotics, and augmented reality.
( Image credit: AVOD )",https://paperswithcode.com/task/3d-object-detection
3D Pose Estimation,"Image credit: GSNet: Joint Vehicle Pose and Shape Reconstruction with Geometrical and Scene-aware Supervision , ECCV'20",https://paperswithcode.com/task/3d-pose-estimation
Action Quality Assessment,Assessing/analyzing/quantifying how well an action was performed.,https://paperswithcode.com/task/action-quality-assessment
Emotion Recognition,"Emotion Recognition is an important area of research to enable effective human-computer interaction. Human emotions can be detected using speech signal, facial expressions, body language, and electroencephalography (EEG). Source: Using Deep Autoencoders for Facial Expression Recognition",https://paperswithcode.com/task/emotion-recognition
Face Detection,"Face Detection is a computer vision task that involves automatically identifying and locating human faces within digital images or videos. It is a fundamental technology that underpins many applications such as face recognition, face tracking, and facial analysis.
( Image credit: insightface )",https://paperswithcode.com/task/face-detection
Face Swapping,"Face swapping refers to the task of swapping faces between images or in an video, while maintaining the rest of the body and environment context.
( Image credit: Swapped Face Detection using Deep Learning and Subjective Assessment )",https://paperswithcode.com/task/face-swapping
Hand Gesture Recognition,This task has no description! Would you like to contribute one?,https://paperswithcode.com/task/hand-gesture-recognition
Hand Pose Estimation,"Hand pose estimation is the task of finding the joints of the hand from an image or set of video frames.
( Image credit: Pose-REN )",https://paperswithcode.com/task/hand-pose-estimation
Lipreading,"Lipreading is a process of extracting speech by watching lip movements of a speaker in the absence of sound. Humans lipread all the time without even noticing. It is a big part in communication albeit not as dominant as audio. It is a very helpful skill to learn especially for those who are hard of hearing.
Deep Lipreading is the process of extracting speech from a video of a silent talking face using deep neural networks. It is also known by few other names: Visual Speech Recognition (VSR), Machine Lipreading, Automatic Lipreading etc.
The primary methodology involves two stages: i) Extracting visual and temporal features from a sequence of image frames from a silent talking video ii) Processing the sequence of features into units of speech e.g. characters, words, phrases etc. We can find several implementations of this methodology either done in two separate stages or trained end-to-end in one go.",https://paperswithcode.com/task/lipreading
Multimodal Activity Recognition,This task has no description! Would you like to contribute one?,https://paperswithcode.com/task/multimodal-activity-recognition
Scene Understanding,"Scene Understanding is something that to understand a scene. For instance, iPhone has function that help eye disabled person to take a photo by discribing what the camera sees. This is an example of Scene Understanding.",https://paperswithcode.com/task/scene-understanding
Video Instance Segmentation,"The goal of video instance segmentation is simultaneous detection, segmentation and tracking of instances in videos. In words, it is the first time that the image instance segmentation problem is extended to the video domain.
To facilitate research on this new task, a large-scale benchmark called YouTube-VIS, which consists of 2,883 high-resolution YouTube videos, a 40-category label set and 131k high-quality instance masks is built.",https://paperswithcode.com/task/video-instance-segmentation
Zero-Shot Video Retrieval,This task has no description! Would you like to contribute one?,https://paperswithcode.com/task/zero-shot-video-retrieval
2D Semantic Segmentation,This task has no description! Would you like to contribute one?,https://paperswithcode.com/task/2d-semantic-segmentation
2D object detection,This task has no description! Would you like to contribute one?,https://paperswithcode.com/task/2d-object-detection
3D Reconstruction,,https://paperswithcode.com/methods/category/3d-reconstruction
Decision Making,"Decision Making is a complex task that involves analyzing data (of different level of abstraction) from disparate sources and with different levels of certainty, merging the information by weighing in on some data source more than other, and arriving at a conclusion by exploring all possible alternatives.
Source: Complex Events Recognition under Uncertainty in a Sensor Network",https://paperswithcode.com/task/decision-making
Dense Video Captioning,"Most natural videos contain numerous events. For example, in a video of a “man playing a piano”, the video might also contain “another man dancing” or “a crowd clapping”. The task of dense video captioning involves both detecting and describing events in a video.",https://paperswithcode.com/task/dense-video-captioning
Face Verification,"Face Verification is a machine learning task in computer vision that involves determining whether two facial images belong to the same person or not. The task involves extracting features from the facial images, such as the shape and texture of the face, and then using these features to compare and verify the similarity between the images.
( Image credit: Pose-Robust Face Recognition via Deep Residual Equivariant Mapping )",https://paperswithcode.com/task/face-verification
Human action generation,"Yan et al. (2019) CSGN:
""When the dancer is stepping, jumping and spinning on the stage, attentions of all audiences are attracted by the streamof the fluent and graceful movements. Building a model that is capable of dancing is as fascinating a task as appreciating the performance itself. In this paper, we aim to generate long-duration human actions represented as skeleton sequences, e.g. those that cover the entirety of a dance, with hundreds of moves and countless possible combinations.""
( Image credit: Convolutional Sequence Generation for Skeleton-Based Action Synthesis )",https://paperswithcode.com/task/human-action-generation
Object Localization,"Object Localization is the task of locating an instance of a particular object category in an image, typically by specifying a tightly cropped bounding box centered on the instance. An object proposal specifies a candidate bounding box, and an object proposal is said to be a correct localization if it sufficiently overlaps a human-labeled “ground-truth” bounding box for the given object. In the literature, the “Object Localization” task is to locate one instance of an object category, whereas “object detection” focuses on locating all instances of a category in a given image.
Source: Fast On-Line Kernel Density Estimation for Active Object Localization",https://paperswithcode.com/task/object-localization
Object Recognition,"Object recognition is a computer vision technique for detecting + classifying objects in images or videos. Since this is a combined task of object detection plus image classification, the state-of-the-art tables are recorded for each component task here and here.
( Image credit: Tensorflow Object Detection API )",https://paperswithcode.com/task/object-recognition
Online Multi-Object Tracking,"The goal of Online Multi-Object Tracking is to estimate the spatio-temporal trajectories of multiple objects in an online video stream (i.e., the video is provided frame-by-frame), which is a fundamental problem for numerous real-time applications, such as video surveillance, autonomous driving, and robot navigation.
Source: A Hybrid Data Association Framework for Robust Online Multi-Object Tracking",https://paperswithcode.com/task/online-multi-object-tracking
Spatio-Temporal Action Localization,This task has no description! Would you like to contribute one?,https://paperswithcode.com/task/spatio-temporal-action-localization
Speaker Recognition,"Speaker Recognition is the process of identifying or confirming the identity of a person given his speech segments.
Source: Margin Matters: Towards More Discriminative Deep Neural Network Embeddings for Speaker Recognition",https://paperswithcode.com/task/speaker-recognition
Unsupervised Domain Adaptation,"Unsupervised Domain Adaptation is a learning framework to transfer knowledge learned from source domains with a large number of annotated training examples to target domains with unlabeled data only.
Source: Domain-Specific Batch Normalization for Unsupervised Domain Adaptation",https://paperswithcode.com/task/unsupervised-domain-adaptation
Video Frame Interpolation,,https://paperswithcode.com/methods/category/video-frame-interpolation
Video Inpainting,"The goal of Video Inpainting is to fill in missing regions of a given video sequence with contents that are both spatially and temporally coherent. Video Inpainting, also known as video completion, has many real-world applications such as undesired object removal and video restoration.
Source: Deep Flow-Guided Video Inpainting",https://paperswithcode.com/task/video-inpainting
Video Recognition,"Video Recognition is a process of obtaining, processing, and analysing data that it receives from a visual source, specifically video.",https://paperswithcode.com/task/video-recognition
Video Super-Resolution,"Video Super-Resolution is a computer vision task that aims to increase the resolution of a video sequence, typically from lower to higher resolutions. The goal is to generate high-resolution video frames from low-resolution input, improving the overall quality of the video.
( Image credit: Detail-revealing Deep Video Super-Resolution )",https://paperswithcode.com/task/video-super-resolution
Zero-Shot Action Recognition,This task has no description! Would you like to contribute one?,https://paperswithcode.com/task/zero-shot-action-recognition
2D Human Pose Estimation,"What is Human Pose Estimation? Human pose estimation is the process of estimating the configuration of the body (pose) from a single, typically monocular, image. Background. Human pose estimation is one of the key problems in computer vision that has been studied for well over 15 years. The reason for its importance is the abundance of applications that can benefit from such a technology. For example, human pose estimation allows for higher-level reasoning in the context of human-computer interaction and activity recognition; it is also one of the basic building blocks for marker-less motion capture (MoCap) technology. MoCap technology is useful for applications ranging from character animation to clinical analysis of gait pathologies.",https://paperswithcode.com/task/2d-human-pose-estimation
3D Hand Pose Estimation,Image: Zimmerman et l,https://paperswithcode.com/task/3d-hand-pose-estimation
3D Object Tracking,This task has no description! Would you like to contribute one?,https://paperswithcode.com/task/3d-object-tracking
Action Anticipation,"Next action anticipation is defined as observing 1, ... , T frames and predicting the action that happens after a gap of T_a seconds. It is important to note that a new action starts after T_a seconds that is not seen in the observed frames. Here T_a=1 second.",https://paperswithcode.com/task/action-anticipation
Action Triplet Recognition,"Recognising action as a triplet of subject verb and object. Example HOI = Human Object Interaction, Surgical IVT = Instrument Verb Target, etc.",https://paperswithcode.com/task/action-triplet-recognition
Action Understanding,This task has no description! Would you like to contribute one?,https://paperswithcode.com/task/action-understanding
Anomaly Detection In Surveillance Videos,This task has no description! Would you like to contribute one?,https://paperswithcode.com/task/anomaly-detection-in-surveillance-videos
Audio-Visual Speech Recognition,Audio-visual speech recognition is the task of transcribing a paired audio and visual stream into text.,https://paperswithcode.com/task/audio-visual-speech-recognition
Crowd Counting,"Crowd Counting is a task to count people in image. It is mainly used in real-life for automated public monitoring such as surveillance and traffic control. Different from object detection, Crowd Counting aims at recognizing arbitrarily sized targets in various situations including sparse and cluttering scenes at the same time.
Source: Deep Density-aware Count Regressor",https://paperswithcode.com/task/crowd-counting
Deblurring,"Deblurring is a computer vision task that involves removing the blurring artifacts from images or videos to restore the original, sharp content. Blurring can be caused by various factors such as camera shake, fast motion, and out-of-focus objects, and can result in a loss of detail and quality in the captured images. The goal of deblurring is to produce a clear, high-quality image that accurately represents the original scene.
( Image credit: Deblurring Face Images using Uncertainty Guided Multi-Stream Semantic Networks )",https://paperswithcode.com/task/deblurring
Disentanglement,"This is an approach to solve a diverse set of tasks in a data efficient manner by disentangling (or isolating ) the underlying structure of the main problem into disjoint parts of its representations. This disentanglement can be done by focussing on the ""transformation"" properties of the world(main problem)",https://paperswithcode.com/task/disentanglement
Domain Adaptation,,https://paperswithcode.com/methods/category/domain-adaptation
Emotion Classification,"Emotion classification, or emotion categorization, is the task of recognising emotions to classify them into the corresponding category. Given an input, classify it as 'neutral or no emotion' or as one, or more, of several given emotions that best represent the mental state of the subject's facial expression, words, and so on. Some example benchmarks include ROCStories, Many Faces of Anger (MFA), and GoEmotions. Models can be evaluated using metrics such as the Concordance Correlation Coefficient (CCC) and the Mean Squared Error (MSE).",https://paperswithcode.com/task/emotion-classification
Emotion Recognition in Conversation,"Given the transcript of a conversation along with speaker information of each constituent utterance, the ERC task aims to identify the emotion of each utterance from several pre-defined emotions. Formally, given the input sequence of N number of utterances [(u1, p1), (u2, p2), . . . , (uN , pN )], where each utterance ui = [ui,1, ui,2, . . . , ui,T ] consists of T words ui,j and spoken by party pi, the task is to predict the emotion label ei of each utterance ui. .",https://paperswithcode.com/task/emotion-recognition-in-conversation
Gesture Recognition,"Gesture Recognition is an active field of research with applications such as automatic recognition of sign language, interaction of humans and robots or for new ways of controlling video games.
Source: Gesture Recognition in RGB Videos Using Human Body Keypoints and Dynamic Time Warping",https://paperswithcode.com/task/gesture-recognition
Human Detection,This task has no description! Would you like to contribute one?,https://paperswithcode.com/task/human-detection
Image Classification,"Image Classification is a fundamental task that attempts to comprehend an entire image as a whole. The goal is to classify the image by assigning it to a specific label. Typically, Image Classification refers to images in which only one object appears and is analyzed. In contrast, object detection involves both classification and localization tasks, and is used to analyze more realistic cases in which multiple objects may exist in an image.
Source: Metamorphic Testing for Object Detection Systems",https://paperswithcode.com/task/image-classification
Image Generation,"Image Generation (synthesis) is the task of generating new images from an existing dataset.
Unconditional generation refers to generating samples unconditionally from the dataset, i.e.
p
(
y
)
Conditional image generation (subtask) refers to generating samples conditionally from the dataset, based on a label, i.e.
p
(
y
|
x
)
.
In this section, you can find state-of-the-art leaderboards for unconditional generation. For conditional generation, and other types of image generations, refer to the subtasks.
( Image credit: StyleGAN )",https://paperswithcode.com/task/image-generation
Interactive Video Object Segmentation,"The interactive scenario assumes the user gives iterative refinement inputs to the algorithm, in our case in the form of a scribble, to segment the objects of interest. Methods have to produce a segmentation mask for that object in all the frames of a video sequence taking into account all the user interactions.",https://paperswithcode.com/task/interactive-video-object-segmentation
Lane Detection,"Lane Detection is a computer vision task that involves identifying the boundaries of driving lanes in a video or image of a road scene. The goal is to accurately locate and track the lane markings in real-time, even in challenging conditions such as poor lighting, glare, or complex road layouts.
Lane detection is an important component of advanced driver assistance systems (ADAS) and autonomous vehicles, as it provides information about the road layout and the position of the vehicle within the lane, which is crucial for navigation and safety. The algorithms typically use a combination of computer vision techniques, such as edge detection, color filtering, and Hough transforms, to identify and track the lane markings in a road scene.
( Image credit: End-to-end Lane Detection )",https://paperswithcode.com/task/lane-detection
Lip Reading,"Lip Reading is a task to infer the speech content in a video by using only the visual information, especially the lip movements. It has many crucial applications in practice, such as assisting audio-based speech recognition, biometric authentication and aiding hearing-impaired people.
Source: Mutual Information Maximization for Effective Lip Reading",https://paperswithcode.com/task/lip-reading
Moment Retrieval,"Moment retrieval can de defined as the task of ""localizing moments in a video given a user query"".
Description from: QVHIGHLIGHTS: Detecting Moments and Highlights in Videos via Natural Language Queries
Image credit: QVHIGHLIGHTS: Detecting Moments and Highlights in Videos via Natural Language Queries",https://paperswithcode.com/task/moment-retrieval
Motion Segmentation,"Motion Segmentation is an essential task in many applications in Computer Vision and Robotics, such as surveillance, action recognition and scene understanding. The classic way to state the problem is the following: given a set of feature points that are tracked through a sequence of images, the goal is to cluster those trajectories according to the different motions they belong to. It is assumed that the scene contains multiple objects that are moving rigidly and independently in 3D-space.
Source: Robust Motion Segmentation from Pairwise Matches",https://paperswithcode.com/task/motion-segmentation
Novel View Synthesis,"Synthesize a target image with an arbitrary target camera pose from given source images and their camera poses.
( Image credit: Multi-view to Novel view: Synthesizing novel views with Self-Learned Confidence )",https://paperswithcode.com/task/novel-view-synthesis
Person Search,"Person Search is a task which aims at matching a specific person among a great number of whole scene images.
Source: Re-ID Driven Localization Refinement for Person Search",https://paperswithcode.com/task/person-search
Pose Tracking,"Pose Tracking is the task of estimating multi-person human poses in videos and assigning unique instance IDs for each keypoint across frames. Accurate estimation of human keypoint-trajectories is useful for human action recognition, human interaction understanding, motion capture and animation.
Source: LightTrack: A Generic Framework for Online Top-Down Human Pose Tracking",https://paperswithcode.com/task/pose-tracking
Real-Time Object Detection,"Real-Time Object Detection is a computer vision task that involves identifying and locating objects of interest in real-time video sequences with fast inference while maintaining a base level of accuracy.
This is typically solved using algorithms that combine object detection and tracking techniques to accurately detect and track objects in real-time. They use a combination of feature extraction, object proposal generation, and classification to detect and localize objects of interest.
( Image credit: CenterNet )",https://paperswithcode.com/task/real-time-object-detection
Self-Supervised Action Recognition,This task has no description! Would you like to contribute one?,https://paperswithcode.com/task/self-supervised-action-recognition
Temporal Action Proposal Generation,This task has no description! Would you like to contribute one?,https://paperswithcode.com/task/temporal-action-proposal-generation
Video Description,"The goal of automatic Video Description is to tell a story about events happening in a video. While early Video Description methods produced captions for short clips that were manually segmented to contain a single event of interest, more recently dense video captioning has been proposed to both segment distinct events in time and describe them in a series of coherent sentences. This problem is a generalization of dense image region captioning and has many practical applications, such as generating textual summaries for the visually impaired, or detecting and describing important events in surveillance footage.
Source: Joint Event Detection and Description in Continuous Video Streams",https://paperswithcode.com/task/video-description
Visual Speech Recognition,This task has no description! Would you like to contribute one?,https://paperswithcode.com/task/visual-speech-recognition
3D Absolute Human Pose Estimation,"This task aims to solve absolute (camera-centric not root-relative) 3D human pose estimation.
( Image credit: RootNet )",https://paperswithcode.com/task/3d-absolute-human-pose-estimation
Abnormal Event Detection In Video,"Abnormal Event Detection In Video is a challenging task in computer vision, as the definition of what an abnormal event looks like depends very much on the context. For instance, a car driving by on the street is regarded as a normal event, but if the car enters a pedestrian area, this is regarded as an abnormal event. A person running on a sports court (normal event) versus running outside from a bank (abnormal event) is another example. Although what is considered abnormal depends on the context, we can generally agree that abnormal events should be unexpected events that occur less often than familiar (normal) events
Source: Unmasking the abnormal events in video
Image: Ravanbakhsh et al",https://paperswithcode.com/task/abnormal-event-detection-in-video
Autonomous Vehicles,"Autonomous vehicles is the task of making a vehicle that can guide itself without human conduction.
Many of the state-of-the-art results can be found at more general task pages such as 3D Object Detection and Semantic Segmentation.
( Image credit: GSNet: Joint Vehicle Pose and Shape Reconstruction with Geometrical and Scene-aware Supervision )",https://paperswithcode.com/task/autonomous-vehicles
Camera shot boundary detection,"The objective of camera shot boundary detection is to find the transitions between the camera shots in a video and classify the type of camera transition. This task is introduced in SoccerNet-v2, where 3 types of transitions are considered (abrupt, logo, smooth).",https://paperswithcode.com/task/camera-shot-boundary-detection
Classification,"Classification is the task of categorizing a set of data into predefined classes or groups. The aim of classification is to train a model to correctly predict the class or group of new, unseen data. The model is trained on a labeled dataset where each instance is assigned a class label. The learning algorithm then builds a mapping between the features of the data and the class labels. This mapping is then used to predict the class label of new, unseen data points. The quality of the prediction is usually evaluated using metrics such as accuracy, precision, and recall.",https://paperswithcode.com/task/classification-1
Dialect Identification,Dialectal Arabic Identification,https://paperswithcode.com/task/dialect-identification
Early Action Prediction,This task has no description! Would you like to contribute one?,https://paperswithcode.com/task/early-action-prediction
Face Presentation Attack Detection,This task has no description! Would you like to contribute one?,https://paperswithcode.com/task/face-presentation-attack-detection
Facial Action Unit Detection,"Facial action unit detection is the task of detecting action units from a video of a face - for example, lip tightening and cheek raising.
( Image credit: Self-supervised Representation Learning from Videos for Facial Action Unit Detection )",https://paperswithcode.com/task/facial-action-unit-detection
Facial Emotion Recognition,Emotion Recognition from facial images,https://paperswithcode.com/task/facial-emotion-recognition
