idx,タスク,概要,url
314,Unsupervised Object Segmentation(監視されていないオブジェクトセグメンテーション),画像クレジット：Clevrtex：監視されていないマルチオブジェクトセグメンテーションのためのテクスチャリッチベンチマーク,https://paperswithcode.com/task/unsupervised-object-segmentation
315,Variational Inference(変分推論),ソース：,https://paperswithcode.com/method/variational-inference
316,Video Classification(ビデオ分類),ビデオ分類は、フレームを考慮してビデオに関連するラベルを作成するタスクです。,https://paperswithcode.com/task/video-classification
317,Video Retrieval(ビデオ検索),ビデオ取得の目的は次のとおりです。テキストクエリと候補ビデオのプールを与えられた場合、テキストクエリに対応するビデオを選択します。,https://paperswithcode.com/task/video-retrieval
318,Video Semantic Segmentation(ビデオセマンティックセグメンテーション),このタスクには説明がありません！,https://paperswithcode.com/task/video-semantic-segmentation
319,Video Super-Resolution(ビデオ超解像度),ビデオスーパー解像度は、ビデオシーケンスの解像度を増やすことを目的としたコンピュータービジョンタスクです。通常は、通常は低解像度から高解像度になります。,https://paperswithcode.com/task/video-super-resolution
320,Vision and Language Navigation(ビジョンと言語ナビゲーション),このタスクには説明がありません！,https://paperswithcode.com/task/vision-and-language-navigation
321,Visual Relationship Detection(視覚的な関係検出),視覚関係検出（VRD）は、画像内のオブジェクト間の関係や相互作用を認識することを目的とした、新しく開発されたコンピュータービジョンタスクの1つです。,https://paperswithcode.com/task/visual-relationship-detection
322,motion prediction(モーション予測),このタスクには説明がありません！,https://paperswithcode.com/task/motion-prediction
323,3D Facial Expression Recognition(3D表現認識),3D表現認識は、画像またはビデオから3Dの表情をモデル化するタスクです。,https://paperswithcode.com/task/3d-facial-expression-recognition
324,3D Human Pose Tracking(3Dヒューマンポーズ追跡),このタスクには説明がありません！,https://paperswithcode.com/task/3d-human-pose-tracking
325,3D Multi-Person Pose Estimation(3Dマルチパーソンポーズ推定),このタスクは、根相対的な3Dマルチパーソンポーズ推定を解決することを目的としています。,https://paperswithcode.com/task/3d-multi-person-pose-estimation
326,3D Object Reconstruction(3Dオブジェクトの再構成),画像：Choy et al,https://paperswithcode.com/task/3d-object-reconstruction
327,3D Point Cloud Reconstruction(3Dポイントクラウドの再構築),3Dポイント雲のエンコードと再構築。,https://paperswithcode.com/task/3d-point-cloud-reconstruction
328,Abnormal Event Detection In Video(ビデオでの異常なイベント検出),ビデオでの異常なイベントの検出は、異常なイベントがどのように見えるかの定義はコンテキストに大きく依存するため、コンピュータービジョンの挑戦的なタスクです。,https://paperswithcode.com/task/abnormal-event-detection-in-video
329,Action Detection(アクション検出),このタスクには説明がありません！,https://paperswithcode.com/task/action-detection
330,Action Recognition In Videos(ビデオでのアクション認識),ビデオのアクション認識は、ビデオシーケンスで実行される人間のアクションを特定して分類することであるコンピュータービジョンとパターン認識のタスクです。,https://paperswithcode.com/task/action-recognition-in-videos-2
331,Action Unit Detection(アクションユニットの検出),アクションユニットの検出は、ビデオからアクションユニットを検出するタスクです。たとえば、顔のビデオからの顔のアクションユニット（唇の引き締め、頬の上昇）の種類です。,https://paperswithcode.com/task/action-unit-detection
332,Age And Gender Classification(年齢と性別分類),年齢と性別の分類は、画像やビデオの人の年齢と性別を識別するためのデュアルタスクです。,https://paperswithcode.com/task/age-and-gender-classification
333,Age-Invariant Face Recognition(年齢不変の顔認識),年齢不変の顔認識は、年齢の違いに不変の顔認識を実行するタスクです。,https://paperswithcode.com/task/age-invariant-face-recognition
334,Blended-target Domain Adaptation(ブレンドターゲットドメインの適応),ブレンドターゲットドメインの適応は、単一のソースモデルを複数の異なるターゲットドメインに適応させることです。,https://paperswithcode.com/task/blended-target-domain-adaptation
335,Blind Face Restoration(盲目の顔の修復),ブラインドフェイス修復は、低解像度、騒音、ぼやけ、圧縮アーティファクトなど、不明な分解に苦しむ低品質の対応物から高品質の顔を回復することを目的としています。実際のシナリオに適用すると、より挑戦的になります。,https://paperswithcode.com/task/blind-face-restoration
336,Body Detection(身体検出),データセットで定義されている人または文字の検出。,https://paperswithcode.com/task/body-detection
337,Boundary Detection(境界検出),境界検出は、画像にエンコードされた情報を抽出する重要な部分であり、密度、速度、圧力などを含む関心の量の計算を可能にします。,https://paperswithcode.com/task/boundary-detection
338,Camera Calibration(カメラのキャリブレーション),このタスクには説明がありません！,https://paperswithcode.com/task/camera-calibration
339,Camera Localization(カメラのローカリゼーション),このタスクには説明がありません！,https://paperswithcode.com/task/camera-localization
340,Change Detection(検出を変更します),変更検出は、時間の経過とともに画像またはビデオシーケンスの変更を検出することを伴うコンピュータービジョンタスクです。,https://paperswithcode.com/task/change-detection
341,Chart Question Answering(チャートの質問応答),チャートの画像の質問に答える,https://paperswithcode.com/task/chart-question-answering
342,Classification with Binary Neural Network(バイナリニューラルネットワークを使用した分類),このタスクには説明がありません！,https://paperswithcode.com/task/classification-with-binary-neural-network
343,Cloud Removal(クラウドの削除),宇宙生まれの衛星を介して収集されたすべての光学観測の大部分は、ヘイズまたは雲の影響を受けます。,https://paperswithcode.com/task/cloud-removal
344,Clustering Algorithms Evaluation(クラスタリングアルゴリズムの評価),このタスクには説明がありません！,https://paperswithcode.com/task/clustering-algorithms-evaluation
345,Color Constancy(色の恒常性),色の恒常性は、人間のビジョンシステムが光源の色に主に不変のシーン内のオブジェクトの色を知覚する能力です。,https://paperswithcode.com/task/color-constancy
346,Compositional Zero-Shot Learning(構成ゼロショット学習),このタスクには説明がありません！,https://paperswithcode.com/task/compositional-zero-shot-learning
347,Contrastive Learning(対照学習),ナンがあります,https://paperswithcode.com/method/contrastive-learning
348,Cross-Modal Person Re-Identification(クロスモーダルの人の再識別),このタスクには説明がありません！,https://paperswithcode.com/task/cross-modal-person-re-identification
349,Cross-View Image-to-Image Translation(クロスビュー画像から画像への翻訳),このタスクには説明がありません！,https://paperswithcode.com/task/cross-view-image-to-image-translation
350,Dense Object Detection(高密度のオブジェクト検出),このタスクには説明がありません！,https://paperswithcode.com/task/dense-object-detection
351,Dense Pixel Correspondence Estimation(高密度ピクセル対応推定),このタスクには説明がありません！,https://paperswithcode.com/task/dense-pixel-correspondence-estimation
352,Diabetic Retinopathy Grading(糖尿病性網膜症のグレーディング),（眼科）眼底画像からの糖尿病性網膜症の重症度を評価する,https://paperswithcode.com/task/diabetic-retinopathy-grading
353,Dialogue Generation(対話の生成),対話の生成は、自然言語の入力を「理解」するタスクです。これは、生産量を生成するための自然言語処理内です。,https://paperswithcode.com/task/dialogue-generation
354,Disparity Estimation(格差の推定),格差の推定は、シーンの同じ3Dポイントに対応するマルチソピックビューでピクセルを見つけるタスクです。,https://paperswithcode.com/task/disparity-estimation
355,Document Text Classification(文書テキスト分類),このタスクには説明がありません！,https://paperswithcode.com/task/document-text-classification
356,Driver Attention Monitoring(ドライバーの注意監視),ドライバーの注意監視は、ドライバーの注意を監視するタスクです。,https://paperswithcode.com/task/driver-attention-monitoring
357,Explainable artificial intelligence(説明可能な人工知能),Xaiは、人工知能（AI）の適用における方法と技術を指し、解決策の結果が人間が理解できるようにします。,https://paperswithcode.com/task/explainable-artificial-intelligence
358,Face Generation(顔の生成),顔の生成は、既存のデータセットから新しい顔を生成（または補間）するタスクです。,https://paperswithcode.com/task/face-generation
359,Face Hallucination(幻覚に直面します),顔の幻覚は、低解像度（LR）入力から高解像度（HR）顔の画像を生成するタスクです。,https://paperswithcode.com/task/face-hallucination
360,Face Model(顔モデル),このタスクには説明がありません！,https://paperswithcode.com/task/face-model
361,Facial Emotion Recognition(顔の感情認識),顔の画像からの感情認識,https://paperswithcode.com/task/facial-emotion-recognition
362,Facial Inpainting(顔の開始),顔の開始（または顔の完成）は、フェイス画像に欠落しているピクセルのもっともらしい顔の構造を生成するタスクです。,https://paperswithcode.com/task/facial-inpainting
363,Fake News Detection(偽のニュース検出),偽のニュース検出は、ニュース記事やその他の種類のテキストを現実または偽物として識別および分類することを伴う自然言語処理タスクです。,https://paperswithcode.com/task/fake-news-detection
364,Feature Importance(特徴の重要性),このタスクには説明がありません！,https://paperswithcode.com/task/feature-importance
365,Few-Shot Semantic Segmentation(少数のセマンティックセグメンテーション),少数のセマンティックセグメンテーション（FSS）は、ピクセルごとの注釈付きサポート画像がほとんどない場合、クエリ画像のターゲットオブジェクトをセグメント化することを学びます。,https://paperswithcode.com/task/few-shot-image-segmentation
366,Fovea Detection(中心窩検出),このタスクには説明がありません！,https://paperswithcode.com/task/fovea-detection
367,Gaze Prediction(視線の予測),このタスクには説明がありません！,https://paperswithcode.com/task/eye-tracking
368,Gender Bias Detection(性別バイアス検出),このタスクには説明がありません！,https://paperswithcode.com/task/gender-bias-detection
369,Generalized Few-Shot Learning(一般化された少数のショット学習),このタスクには説明がありません！,https://paperswithcode.com/task/generalized-few-shot-learning
370,Grasp Contact Prediction(連絡先の予測を把握します),オブジェクトとハンド（人間またはロボット）の接触を予測します。,https://paperswithcode.com/task/human-grasp-contact-prediction
371,Grayscale Image Denoising(グレースケール画像除去),このタスクには説明がありません！,https://paperswithcode.com/task/grayscale-image-denoising
372,Hand Segmentation(ハンドセグメンテーション),このタスクには説明がありません！,https://paperswithcode.com/task/hand-segmentation
373,Handwriting Verification(手書きの確認),手書きの検証の目標は、指定された手書きのサンプルが同じ作家によって書かれているかどうかにかかわらず、自信の尺度を見つけることです。,https://paperswithcode.com/task/handwriting-verification
374,Histopathological Image Classification(組織病理学的画像分類),このタスクには説明がありません！,https://paperswithcode.com/task/histopathological-image-classification
375,Human action generation(人間のアクションジェネレーション),Yan et al。,https://paperswithcode.com/task/human-action-generation
376,Image Cropping(画像トリミング),画像のトリミングは一般的な写真操作プロセスであり、不要な領域を除去することで全体的な構成を改善します。,https://paperswithcode.com/task/image-cropping
377,Image Forensics(画像フォレンジック),このタスクには説明がありません！,https://paperswithcode.com/task/image-forensics
378,Image Manipulation(画像操作),このタスクには説明がありません！,https://paperswithcode.com/task/image-manipulation
379,Joint Demosaicing and Denoising(関節のデモ除孔と除去),このタスクには説明がありません！,https://paperswithcode.com/task/joint-demosaicing-and-denoising
380,Layout-to-Image Generation(レイアウトから画像の生成),レイアウトから画像への生成指定されたレイアウトに基づいてシーンを生成するタスク。,https://paperswithcode.com/task/layout-to-image-generation
381,Lung Nodule Detection(肺結節の検出),このタスクには説明がありません！,https://paperswithcode.com/task/lung-nodule-detection
382,Machine Translation(機械翻訳),機械の翻訳は、ソース言語の文を別のターゲット言語に翻訳するタスクです。,https://paperswithcode.com/task/machine-translation
383,Material Classification(材料分類),このタスクには説明がありません！,https://paperswithcode.com/task/material-classification
384,Medical Image Classification(医療画像分類),医療画像分類は、X線、MRIスキャン、CTスキャンなどの医療画像を、画像の種類または特定の構造または疾患の存在に基づいて異なるカテゴリに分類することを含む医療画像分析のタスクです。,https://paperswithcode.com/task/medical-image-classification
385,Medical Image Registration(医療画像登録),画像登録は、画像の融合または画像マッチングとも呼ばれ、画像の外観に基づいて2つ以上の画像を調整するプロセスです。,https://paperswithcode.com/task/medical-image-registration
386,Meme Classification(ミーム分類),ミーム分類とは、インターネットミームを分類するタスクを指します。,https://paperswithcode.com/task/meme-classification
387,Micro-Expression Recognition(微小表現認識),顔の微小表現認識は、ハイステーク環境で抑制された感情を特定する上で困難な作業であり、多くの場合、非常に短い期間と微妙な変化があります。,https://paperswithcode.com/task/micro-expression-recognition
388,Model Poisoning(モデル中毒),このタスクには説明がありません！,https://paperswithcode.com/task/model-poisoning
389,Monocular 3D Object Detection(単眼3Dオブジェクト検出),単眼3Dオブジェクト検出は、単一の2D RGB画像でオブジェクトの周りに3D境界ボックスを描画するタスクです。,https://paperswithcode.com/task/monocular-3d-object-detection
390,Motion Estimation(モーション推定),モーション推定は、2つのフレーム間のブロックごとまたはピクセルごとのモーションベクトルを決定するために使用されます。,https://paperswithcode.com/task/motion-estimation
391,Multi-Human Parsing(多人の解析),複数の人間の解析は、混雑したシーンで複数の人間を解析するタスクです。,https://paperswithcode.com/task/multi-human-parsing
392,Multi-Source Unsupervised Domain Adaptation(マルチソースの監視なしドメイン適応),このタスクには説明がありません！,https://paperswithcode.com/task/multi-source-unsupervised-domain-adaptation
393,Multi-object discovery(マルチオブジェクトの発見),このタスクには説明がありません！,https://paperswithcode.com/task/multi-object-discovery
394,Multi-target Domain Adaptation(マルチターゲットドメインの適応),マルチターゲットドメイン適応のアイデアは、単一のラベル付きソースドメインから複数の非標識ターゲットドメインにモデルを適応させることです。,https://paperswithcode.com/task/multi-target-domain-adaptation
395,Multi-tissue Nucleus Segmentation(多ティュー核のセグメンテーション),このタスクには説明がありません！,https://paperswithcode.com/task/multi-tissue-nucleus-segmentation
396,Multimodal Sentiment Analysis(マルチモーダル感情分析),マルチモーダル感情分析は、複数のデータソースを使用して感情分析を実行するタスクです。,https://paperswithcode.com/task/multimodal-sentiment-analysis
397,Multimodal Unsupervised Image-To-Image Translation(マルチモーダル監督なしの画像から画像への翻訳),マルチモーダル監督なしの画像から画像への翻訳は、別のドメイン内の単一の画像から1つのドメインに複数の翻訳を生成するタスクです。,https://paperswithcode.com/task/multimodal-unsupervised-image-to-image
398,Multiview Detection(マルチビュー検出),大量に閉塞されたシナリオで検出するために複数のカメラビューを組み込む。,https://paperswithcode.com/task/multiview-detection
399,Named Entity Recognition (NER)(名前付きエンティティ認識（NER）),名前付きエンティティ認識（NER）は、自然言語処理（NLP）のタスクです。これは、名前、組織、場所などの事前定義されたカテゴリにテキスト内の名前のエンティティを識別および分類します。,https://paperswithcode.com/task/named-entity-recognition-ner
400,Neural Rendering(ニューラルレンダリング),何らかの種類の3Dシーン（ポイントクラウド、メッシュ、ボクセルなど）の表現を考えると、タスクは、任意の視点からこのシーンの光エアリスティックなレンダリングを生成できるアルゴリズムを作成することです。,https://paperswithcode.com/task/neural-rendering
401,Novel Class Discovery(新しいクラスの発見),Nove Class Discovery（NCD）の目標は、既知のクラスからの事前知識を活用することにより、非標識データの新しいクラスを特定することです。,https://paperswithcode.com/task/novel-class-discovery
402,One-Shot Learning(ワンショット学習),ワンショット学習は、単一のトレーニング例からオブジェクトカテゴリに関する情報を学習するタスクです。,https://paperswithcode.com/task/one-shot-learning
403,One-Shot Object Detection(ワンショットオブジェクトの検出),（画像クレジット：シャムマスクR-CNN）,https://paperswithcode.com/task/one-shot-object-detection
404,One-stage Anchor-free Oriented Object Detection(1段階のアンカーフリー配向オブジェクト検出),このタスクには説明がありません！,https://paperswithcode.com/task/one-stage-anchor-free-oriented-object-1
405,Online Multi-Object Tracking(オンラインマルチオブジェクトトラッキング),オンラインマルチオブジェクトトラッキングの目標は、オンラインビデオストリーム内の複数のオブジェクトの時空間的軌跡（つまり、ビデオがフレームごとに提供される）を推定することです。これは、多数のリアルタイムアプリケーションの基本的な問題です。,https://paperswithcode.com/task/online-multi-object-tracking
406,Open-World Semi-Supervised Learning(Open-World Semi-Supervised Learning),このタスクには説明がありません！,https://paperswithcode.com/task/open-world-semi-supervised-learning
407,Optic Disc Detection(光学ディスク検出),光学板の地域提案,https://paperswithcode.com/task/optic-disc-detection
408,Optic Disc Segmentation(光学ディスクセグメンテーション),このタスクには説明がありません！,https://paperswithcode.com/task/optic-disc-segmentation
409,Patch Matching(パッチマッチング),このタスクには説明がありません！,https://paperswithcode.com/task/patch-matching
410,Physical Attribute Prediction(物理属性予測),このタスクには説明がありません！,https://paperswithcode.com/task/physical-attribute-prediction
411,Pose Tracking(ポーズトラッキング),ポーズトラッキングは、ビデオでマルチパーソンの人間のポーズを推定し、各キーポイントにフレーム間で一意のインスタンスIDを割り当てるタスクです。,https://paperswithcode.com/task/pose-tracking
412,Probabilistic Deep Learning(確率的な深い学習),このタスクには説明がありません！,https://paperswithcode.com/task/probabilistic-deep-learning
413,Product Recommendation(製品の推奨),このタスクには説明がありません！,https://paperswithcode.com/task/product-recommendation
414,Rain Removal(雨の除去),このタスクには説明がありません！,https://paperswithcode.com/task/rain-removal
415,Real-time Instance Segmentation(リアルタイムインスタンスセグメンテーション),親タスク、インスタンスセグメンテーションと同様ですが、定義された設定の下でリアルタイム機能を達成することを目的としています。,https://paperswithcode.com/task/real-time-instance-segmentation
416,Region Proposal(地域の提案),ナンがあります,https://paperswithcode.com/methods/category/region-proposal
417,Relation Extraction(関係抽出),関係抽出は、文のエンティティの属性と関係を予測するタスクです。,https://paperswithcode.com/task/relation-extraction
418,Retrieval(検索),このタスクには説明がありません！,https://paperswithcode.com/task/retrieval
419,Robust Face Recognition(堅牢なフェイス認識),堅牢な顔認識は、視点、スケール、ポーズ、照明、顔画像の表現の変動がある制約のない環境で認識を実行するタスクです。,https://paperswithcode.com/task/robust-face-recognition
420,Robust classification(堅牢な分類),このタスクには説明がありません！,https://paperswithcode.com/task/robust-classification
421,Satellite Image Classification(衛星画像分類),衛星画像分類は、コンピューター化された研究と衛星情報のパターン認識のためにリモートセンシングで使用される最も重要な手法です。これは、使用済み分類アルゴリズムに応じてトレーニングサンプルの厳密な検証を含む画像の多様性構造に基づいています。,https://paperswithcode.com/task/satellite-image-classification
422,Scene Flow Estimation(シーンフローの推定),シーンフローの推定は、自律的なナビゲーションのコンテキストで、環境知覚にとって重要な3D構造と3D動的シーンの3Dモーションを取得するタスクです。,https://paperswithcode.com/task/scene-flow-estimation
423,Scene Graph Detection(シーングラフの検出),このタスクには説明がありません！,https://paperswithcode.com/task/scene-graph-detection
424,Semantic Image-Text Similarity(セマンティック画像テキストの類似性),このタスクには説明がありません！,https://paperswithcode.com/task/semantic-image-text-similarity
425,Semantic SLAM(セマンティックスラム),セマンティックレベルのシーンの理解でスラム,https://paperswithcode.com/task/semantic-slam
426,Semantic correspondence(意味対応),セマンティック対応のタスクは、同じオブジェクトカテゴリの異なるインスタンス間で信頼できる視覚的対応を確立することを目的としています。,https://paperswithcode.com/task/semantic-correspondence
427,Semi Supervised Learning for Image Captioning(画像キャプションのための半教師の学習),このタスクには説明がありません！,https://paperswithcode.com/task/semi-supervised-learning-for-image-captioning
