idx,タスク,概要,url
96,Multi-Object Tracking(マルチオブジェクト追跡),マルチオブジェクトトラッキングは、ビデオシーケンス内で複数のオブジェクトの検出と追跡を伴うコンピュータービジョンのタスクです。,https://paperswithcode.com/task/multi-object-tracking
97,Object Detection In Indoor Scenes(屋内シーンでのオブジェクト検出),屋内シーンでのオブジェクト検出は、屋内環境内でオブジェクト検出を実行するタスクです。,https://paperswithcode.com/task/object-detection-in-indoor-scenes
98,RGB Salient Object Detection(RGB顕著なオブジェクト検出),RGB Salientオブジェクト検出は、視覚的な注意メカニズムに基づいたタスクベースであり、アルゴリズムは、シーンまたはRGB画像の周囲の領域よりも注意深いオブジェクトまたは領域を探索することを目的としています。,https://paperswithcode.com/task/salient-object-detection
99,Scene Text Detection(シーンテキストの検出),シーンテキストの検出は、自然な画像やビデオ内のテキストを自動的に識別およびローカライズすることを含むコンピュータービジョンタスクです。,https://paperswithcode.com/task/scene-text-detection
100,Text-to-Image Generation(テキストから画像への生成),テキストから画像の生成は、特定のテキスト説明に対応する画像を生成することを目標とするコンピュータービジョンと自然言語処理のタスクです。,https://paperswithcode.com/task/text-to-image-generation
101,Vehicle Re-Identification(車両の再識別),車両の再識別は、複数のカメラで同じ車両を識別するタスクです。,https://paperswithcode.com/task/vehicle-re-identification
102,Video Object Segmentation(ビデオオブジェクトセグメンテーション),ビデオオブジェクトのセグメンテーションは、ビデオの背景領域から前景オブジェクトを分離することを目的としたバイナリラベリングの問題です。,https://paperswithcode.com/task/video-object-segmentation
103,Video Understanding(ビデオ理解),ビデオ理解の重要なタスクは、ビデオに表示されるさまざまなアクションまたはイベントを（空間と時間で）認識してローカライズすることです。,https://paperswithcode.com/task/video-understanding
104,Visual Place Recognition(視覚的な場所認識),視覚的な場所の認識は、別の時間に撮影された同じ場所の異なるビューで、場所のビューを一致させるタスクです。,https://paperswithcode.com/task/visual-place-recognition
105,Weakly Supervised Object Detection(監視されたオブジェクトの検出),弱く監視されたオブジェクト検出（WSOD）は、画像タグの監視のみを備えたオブジェクト検出器をトレーニングするタスクです。,https://paperswithcode.com/task/weakly-supervised-object-detection
106,3D Face Reconstruction(3Dフェイスの再構築),3Dフェイス再構築は、2D画像または一連の画像から人間の顔の3Dモデルを作成することを含むコンピュータービジョンタスクです。,https://paperswithcode.com/task/3d-face-reconstruction
107,3D Instance Segmentation(3Dインスタンスセグメンテーション),画像：Occuseg,https://paperswithcode.com/task/3d-instance-segmentation-1
108,3D Semantic Segmentation(3Dセマンティックセグメンテーション),3Dセマンティックセグメンテーションは、3Dポイントクラウドまたは3Dメッシュを意味的に意味のある部品または領域に分割することを含むコンピュータービジョンタスクです。,https://paperswithcode.com/task/3d-semantic-segmentation
109,Computed Tomography (CT)(コンピューター断層撮影（CT）),「コンピューター断層撮影」という用語（CT）は、X線の狭いビームが患者を対象とし、体の周りを素早く回転させ、マシンのコンピューターによって処理される信号を生成するコンピューター化されたX線イメージング手順を指します。,https://paperswithcode.com/task/computed-tomography-ct
110,Decision Making(意思決定),意思決定は、異なるソースから、およびさまざまなレベルの確実性で（異なるレベルの抽象化の）データを分析し、他のデータソースよりも多くのデータソースを比較検討することで情報をマージし、可能な限りすべてを探索することによって結論に到達する複雑なタスクです。,https://paperswithcode.com/task/decision-making
111,Generalized Zero-Shot Learning(一般化されたゼロショット学習),このタスクには説明がありません！,https://paperswithcode.com/task/generalized-zero-shot-learning
112,Gesture Recognition(ジェスチャー認識),ジェスチャー認識は、手話の自動認識、人間とロボットの相互作用、またはビデオゲームを制御する新しい方法などのアプリケーションを使用した積極的な研究分野です。,https://paperswithcode.com/task/gesture-recognition
113,Handwriting generation(手書きの生成),手書き認識の逆。,https://paperswithcode.com/task/handwriting-generation
114,Handwritten Text Recognition(手書きのテキスト認識),このタスクには説明がありません！,https://paperswithcode.com/task/handwritten-text-recognition
115,Image Registration(画像登録),画像登録は、さまざまなデータセットを1つの座標系に変換するプロセスです。,https://paperswithcode.com/task/image-registration
116,Image Restoration(画像の復元),画像修復は、破損した入力画像から高品質の画像を取得するための逆の問題のファミリーです。,https://paperswithcode.com/task/image-restoration
117,Lane Detection(レーン検出),レーン検出は、道路シーンのビデオまたは画像で車線を駆動する境界を識別することを伴うコンピュータービジョンタスクです。,https://paperswithcode.com/task/lane-detection
118,Medical Diagnosis(医療診断),医学的診断は、特定の危険因子、兆候、症状、および試験結果の評価に基づいて、患者が影響を受ける疾患を特定するプロセスです。,https://paperswithcode.com/task/medical-diagnosis
119,Multimodal Deep Learning(マルチモーダルディープラーニング),マルチモーダルディープラーニングは、テキスト、画像、オーディオ、ビデオなどの複数のモダリティからの情報を組み合わせて、より正確で包括的な予測を行う一種のディープラーニングです。,https://paperswithcode.com/task/multimodal-deep-learning
120,Out-of-Distribution Detection(分散除外検出),分散または異常な例を検出します。,https://paperswithcode.com/task/out-of-distribution-detection
121,Prompt Engineering(迅速なエンジニアリング),プロンプトエンジニアリングは、言語モデルから情報をより効率的に抽出するための多数のプロンプトを作成する慣行です。,https://paperswithcode.com/methods/category/prompt-engineering
122,Small Data Image Classification(小さなデータ画像分類),数百から数百のラベル付きトレーニングの例を使用した教師付き画像分類。,https://paperswithcode.com/task/small-data
123,Style Transfer(スタイル転送),スタイル転送は、ある画像のコンテンツを別の画像のスタイルと組み合わせることにより、新しい画像を生成することを含むコンピュータービジョンとグラフィックスの手法です。,https://paperswithcode.com/task/style-transfer
124,Text Generation(テキスト生成),テキスト生成は、人間が作成したテキストと見分けがつかないように見えることを目指して、テキストを生成するタスクです。,https://paperswithcode.com/task/text-generation
125,Transfer Learning(転送学習),転送学習は、1つのタスクでトレーニングされたモデルが再利用され、関連するが異なるタスクのために微調整されている機械学習手法です。,https://paperswithcode.com/task/transfer-learning
126,Tumor Segmentation(腫瘍のセグメンテーション),腫瘍のセグメンテーションは、腫瘍の空間的位置を特定するタスクです。,https://paperswithcode.com/task/tumor-segmentation
127,Unsupervised Semantic Segmentation(監視されていないセマンティックセグメンテーション),グラウンドトゥルースラベルを表示せずに、各画像をセグメント化することを学ぶ（つまり、すべてのピクセルにクラスを割り当てる）モデル。,https://paperswithcode.com/task/unsupervised-semantic-segmentation
128,Visual Navigation(視覚ナビゲーション),視覚ナビゲーションは、エージェントをナビゲートする問題です。,https://paperswithcode.com/task/visual-navigation
129,Animal Pose Estimation(動物のポーズ推定),動物のポーズ推定は、動物のポーズを特定するタスクです。,https://paperswithcode.com/task/animal-pose-estimation
130,Color Image Denoising(カラー画像除去),このタスクには説明がありません！,https://paperswithcode.com/task/color-image-denoising
131,Conditional Image Generation(条件付き画像生成),条件付き画像生成は、クラスを条件とするデータセットから新しい画像を生成するタスクです。,https://paperswithcode.com/task/conditional-image-generation
132,Disaster Response(災害対応),このタスクには説明がありません！,https://paperswithcode.com/task/disaster-response
133,Fine-Grained Image Recognition(細粒の画像認識),このタスクには説明がありません！,https://paperswithcode.com/task/fine-grained-image-recognition
134,Generalizable Person Re-identification(一般化可能な人の再識別),一般化可能な人の再識別とは、ソースデータセットでトレーニングされた方法を指しますが、ドメインの適応または転送学習なしでターゲットデータセットで直接評価されます。,https://paperswithcode.com/task/generalizable-person-re-identification
135,Human Detection(人間の検出),このタスクには説明がありません！,https://paperswithcode.com/task/human-detection
136,Human Part Segmentation(人間の部分セグメンテーション),このタスクには説明がありません！,https://paperswithcode.com/task/human-part-segmentation
137,Image Dehazing(画像の脱線),（画像クレジット：密に接続されたピラミッド脱hazingネットワーク）,https://paperswithcode.com/task/image-dehazing
138,Image Enhancement(画像強化),画像の強化は、基本的に、人間の視聴者向けの画像の情報の解釈性または認識を改善し、他の自動化された画像処理技術に「より良い」入力を提供しています。,https://paperswithcode.com/task/image-enhancement
139,Keypoint Detection(キーポイント検出),キーポイント検出には、同時に人を検出し、キーポイントをローカライズすることが含まれます。,https://paperswithcode.com/task/keypoint-detection
140,Lesion Classification(病変分類),このタスクには説明がありません！,https://paperswithcode.com/task/lesion-classification
141,License Plate Recognition(ナンバープレートの認識),このタスクには説明がありません！,https://paperswithcode.com/task/license-plate-recognition
142,Low-Light Image Enhancement(低光画像の強化),低光画像の強化は、低照度条件下でキャプチャされた画像の品質を改善することを伴うコンピュータービジョンタスクです。,https://paperswithcode.com/task/low-light-image-enhancement
143,Real-Time Object Detection(リアルタイムオブジェクトの検出),リアルタイムオブジェクトの検出は、基本レベルの精度を維持しながら、高速推論を備えたリアルタイムビデオシーケンスで関心のあるオブジェクトを識別して特定することを伴うコンピュータービジョンタスクです。,https://paperswithcode.com/task/real-time-object-detection
144,Real-Time Semantic Segmentation(リアルタイムセマンティックセグメンテーション),セマンティックセグメンテーションは、画像内の各ピクセルにセマンティックラベルを割り当てることを含むコンピュータービジョンタスクです。,https://paperswithcode.com/task/real-time-semantic-segmentation
145,Relational Reasoning(リレーショナル推論),リレーショナル推論の目標は、画像ピクセル、単語や文、人間のスケルトン、インタラクティブな移動エージェントなど、さまざまなエンティティ間の関係を把握することです。,https://paperswithcode.com/task/relational-reasoning
146,Robust Object Detection(堅牢なオブジェクト検出),のベンチマーク：オブジェクト検出モデルの堅牢性腐敗と歪みを画像化する,https://paperswithcode.com/task/robust-object-detection
147,Stochastic Optimization(確率的最適化),確率的最適化方法は、ニューラルネットワークを最適化するために使用されます。,https://paperswithcode.com/methods/category/stochastic-optimization
148,Surface Normals Estimation(表面正常推定),表面通常の推定は、シーン内に存在するオブジェクトの表面向きを予測するタスクを扱います。,https://paperswithcode.com/task/surface-normals-estimation
149,Table Detection(テーブル検出),画像クレジット：野生のテーブル検出：新しい多様なテーブル検出データセットと方法,https://paperswithcode.com/task/table-detection
150,Text Classification(テキスト分類),テキスト分類は、文または文書を適切なカテゴリに割り当てるタスクです。,https://paperswithcode.com/task/text-classification
151,Unsupervised Semantic Segmentation with Language-image Pre-training(言語イメージの事前トレーニングによる監視されていないセマンティックセグメンテーション),画像レベルのラベルで事前に訓練された機能で初期化されたバックボーンを除き、セマンティックセグメンテーションのために人間レベルの監督を使用しないセグメンテーションタスク。,https://paperswithcode.com/task/unsupervised-semantic-segmentation-with
152,Visual Commonsense Reasoning(視覚的な常識的な推論),画像ソース：Visual Commonsense推論,https://paperswithcode.com/task/visual-commonsense-reasoning
153,Visual Tracking(視覚追跡),視覚追跡は、ロボットサービス、スマートサーベイランスシステム、自律運転、人間のコンピューターの相互作用など、さまざまな現実世界のアプリケーションを備えたコンピュータービジョンの分野における重要な積極的に研究された問題です。,https://paperswithcode.com/task/visual-tracking
154,3D Depth Estimation(3D深度推定),画像：Monodepth2,https://paperswithcode.com/task/3d-depth-estimation
155,3D Shape Reconstruction(3D形状の再構築),画像クレジット：GSNET：幾何学的およびシーン認識監督によるジョイントビークルのポーズと形状の再構築、ECCV'20,https://paperswithcode.com/task/3d-shape-reconstruction
156,6D Pose Estimation(6Dポーズ推定),画像：Zeng et al,https://paperswithcode.com/task/6d-pose-estimation-1
157,Activity Recognition(アクティビティ認識),人間の活動認識は、ビデオ入力を与えられた人間によって実行されたイベントを特定する問題です。,https://paperswithcode.com/task/activity-recognition
158,Adversarial Robustness(敵対的な堅牢性),敵対的な堅牢性は、さまざまな種類の敵対的攻撃の下で機械学習モデルの脆弱性を評価します。,https://paperswithcode.com/task/adversarial-robustness
159,Blind Super-Resolution(盲目の超解像度),このタスクには説明がありません！,https://paperswithcode.com/task/blind-super-resolution
160,COVID-19 Diagnosis(Covid-19診断),Covid-19診断は、機械学習を持つ個人におけるCovid-19の存在を診断するタスクです。,https://paperswithcode.com/task/covid-19-detection
161,Colorectal Polyps Characterization(結腸直腸ポリープの特性評価),このタスクには説明がありません！,https://paperswithcode.com/task/colorectal-polyps-characterization
162,Colorization(着色),色付けは、画像表現を学ぶために口実として色付けに依存する自己監視アプローチです。,https://paperswithcode.com/method/colorization
163,Deblurring(デブラー),DeBluringは、画像やビデオからぼやけたアーティファクトを削除して、元のシャープなコンテンツを復元するコンピュータービジョンタスクです。,https://paperswithcode.com/task/deblurring
164,DeepFake Detection(ディープフェイク検出),DeepFake検出は、ディープラーニングテクニックを使用して生成された偽のビデオまたは画像を検出するタスクです。,https://paperswithcode.com/task/deepfake-detection
165,Depth Completion(深さ完了),深さ完了タスクは、深度推定のサブ問題です。,https://paperswithcode.com/task/depth-completion
166,Face Swapping(顔交換),フェイススワッピングとは、身体と環境の文脈の残りを維持しながら、画像間またはビデオで顔を交換するタスクを指します。,https://paperswithcode.com/task/face-swapping
167,Fairness(公平性),このタスクには説明がありません！,https://paperswithcode.com/task/fairness
168,Food Recognition(食品認識),このタスクには説明がありません！,https://paperswithcode.com/task/food-recognition
169,Graph Matching(グラフマッチング),グラフマッチングは、複雑なリレーショナル情報を保存しながら、2つの頂点間で対応を見つける問題です。,https://paperswithcode.com/task/graph-matching
170,Hyperspectral Image Classification(ハイパースペクトル画像分類),ハイパースペクトル画像分類は、リモートセンシングとコンピュータービジョンの分野でのタスクです。,https://paperswithcode.com/task/hyperspectral-image-classification
171,Image Quality Assessment(画質評価),このタスクには説明がありません！,https://paperswithcode.com/task/image-quality-assessment
172,Image-to-Text Retrieval(画像からテキストへの検索),このタスクには説明がありません！,https://paperswithcode.com/task/image-to-text-retrieval
173,Incremental Learning(増分学習),Incremental Learningは、以前に学んだタスクから学んだ知識を維持しながら、新しいデータからの新しいタスクに対処することを継続的に学習できる人工的にインテリジェントなシステムを開発することを目的としています。,https://paperswithcode.com/task/incremental-learning
174,Information Retrieval(情報検索),情報検索は、クエリに応じてドキュメントまたは検索結果のリストをランキングするタスクです,https://paperswithcode.com/task/information-retrieval
175,Language Modelling(言語モデリング),言語モデリングは、ドキュメント内の次の単語または文字を予測するタスクです。,https://paperswithcode.com/task/language-modelling
176,Learning with noisy labels(騒々しいラベルで学習します),ノイズの多いラベルで学ぶことは、「ノイズの多いラベル」と言うとき、敵が意図的にラベルを台無しにしたことを意味します。,https://paperswithcode.com/task/learning-with-noisy-labels
177,License Plate Detection(ナンバープレートの検出),ナンバープレート認識は、ナンバープレートで車両を識別するために使用される画像処理テクノロジーです。,https://paperswithcode.com/task/license-plate-detection
178,Multi-Label Image Classification(マルチラベル画像分類),マルチラベル画像分類は、各画像が複数のクラスに属する可能性のあるマルチクラス分類問題の画像のラベルの予測に焦点を当てています。,https://paperswithcode.com/task/multi-label-image-classification
179,Multiple Object Tracking(複数のオブジェクトトラッキング),複数のオブジェクト追跡は、ビデオ内の複数のオブジェクトを自動的に識別し、それらを高精度のある一連の軌跡として表す問題です。,https://paperswithcode.com/task/multiple-object-tracking
180,Node Classification(ノード分類),ノード分類は、グラフベースのデータ分析における機械学習タスクであり、目標は、ノードのプロパティとそれらの間の関係に基づいてグラフのノードにラベルを割り当てることです。,https://paperswithcode.com/task/node-classification
181,Optical Charater Recogntion(光学文字認識),このタスクには説明がありません！,https://paperswithcode.com/task/optical-charater-recogntion
182,Phrase Grounding(フレーズの接地),画像と対応するキャプションを与えられたフレーズの接地タスクは、キャプション内の名詞句で言及された各エンティティを画像内の領域に接地することを目的としています。,https://paperswithcode.com/task/phrase-grounding
183,Pose Prediction(予測のポーズ),ポーズ予測は、以前のポーズのウィンドウを考慮して、将来のポーズを予測することです。,https://paperswithcode.com/task/pose-prediction
184,Single-View 3D Reconstruction(シングルビュー3D再構成),このタスクには説明がありません！,https://paperswithcode.com/task/single-view-3d-reconstruction
185,Speech Recognition(音声認識),ナンがあります,https://paperswithcode.com/methods/category/speech-recognition
186,Temporal Action Localization(一時的なアクションローカリゼーション),一時的なアクションローカリゼーションは、ビデオストリームのアクティビティと出力の開始および終了タイムスタンプを検出することを目的としています。,https://paperswithcode.com/task/action-recognition
187,Unsupervised Image Classification(監視されていない画像分類),グラウンドトゥルースラベルを見ることなく、各画像（つまり、データセットをグラウンドトゥルースクラスにクラスター化する）を学ぶモデル。,https://paperswithcode.com/task/unsupervised-image-classification
188,Vision-Language Navigation(ビジョン言語ナビゲーション),Vision-Language Navigation（VLN）は、具体化されたエージェントをナビゲートして、実際の3D環境内で自然言語の指示を実行するタスクです。,https://paperswithcode.com/task/vision-language-navigation
189,Visual Dialog(ビジュアルダイアログ),視覚的なダイアログでは、AIエージェントが視覚コンテンツに関する自然な会話言語で人間と意味のあるダイアログを保持する必要があります。,https://paperswithcode.com/task/visual-dialogue
190,Zero-Shot Object Detection(ゼロショットオブジェクト検出),ゼロショットオブジェクト検出（ZSD）は、ターゲットオブジェクトクラスの一部で視覚的なトレーニングデータが利用できないオブジェクト検出のタスクです。,https://paperswithcode.com/task/zero-shot-object-detection
191,Zero-Shot Transfer Image Classification(ゼロショット転送画像分類),このタスクには説明がありません！,https://paperswithcode.com/task/zero-shot-transfer-image-classification
192,3D Absolute Human Pose Estimation(3D絶対人間のポーズ推定),このタスクは、絶対（カメラ中心の根相対的ではない）3Dヒトポーズ推定を解決することを目的としています。,https://paperswithcode.com/task/3d-absolute-human-pose-estimation
193,3D Human Reconstruction(3D人間の再建),このタスクには説明がありません！,https://paperswithcode.com/task/3d-human-reconstruction
194,3D Human Shape Estimation(3Dヒト形状推定),このタスクには説明がありません！,https://paperswithcode.com/task/3d-human-shape-estimation
195,Active Learning(能動的学習),ナンがあります,https://paperswithcode.com/methods/category/active-learning
196,Adversarial Defense(敵対的な防御),現在未発表の結果を伴う競争：,https://paperswithcode.com/task/adversarial-defense
197,Class-agnostic Object Detection(クラスに依存しないオブジェクト検出),クラスに依存しないオブジェクト検出は、カテゴリを指定せずに画像内のオブジェクトをローカライズすることを目的としています。,https://paperswithcode.com/task/class-agnostic-object-detection
198,Dictionary Learning(辞書学習),辞書学習は、計算神経科学、機械学習、コンピュータービジョン、画像処理まで、複数の分野で重要な問題です。,https://paperswithcode.com/task/dictionary-learning
