idx,タスク,概要,url
0,Semantic Segmentation(セマンティックセグメンテーション),セマンティックセグメンテーションは、画像内の各ピクセルをクラスまたはオブジェクトに分類することを目標とするコンピュータービジョンタスクです。,https://paperswithcode.com/task/semantic-segmentation
1,Object Detection(オブジェクトの検出),オブジェクトの検出は、目標が画像またはビデオで関心のあるオブジェクトを検出して見つけることであるコンピュータービジョンタスクです。,https://paperswithcode.com/task/object-detection
2,Image Classification(画像分類),画像分類は、画像全体を全体として理解しようとする基本的なタスクです。,https://paperswithcode.com/task/image-classification
3,Pose Estimation(推定のポーズ),ポーズ推定は、人またはオブジェクトの位置と方向を検出することを目標とするコンピュータービジョンタスクです。,https://paperswithcode.com/task/pose-estimation
4,Face Recognition(顔認識),顔認識は、既存の顔のデータベースに対して写真またはビデオ画像で顔を肯定的に識別するタスクです。,https://paperswithcode.com/task/face-recognition
5,Visual Question Answering (VQA)(視覚的な質問応答（VQA）),視覚的な質問応答（VQA）は、画像に関する質問への回答を含むコンピュータービジョンのタスクです。,https://paperswithcode.com/task/visual-question-answering
6,Image Retrieval(画像検索),画像検索は、特定のクエリ画像に似た大規模なデータベース内の画像を検索することを含むコンピュータービジョンタスクです。,https://paperswithcode.com/task/image-retrieval
7,Depth Estimation(深度推定),深さの推定は、カメラに対する各ピクセルの距離を測定するタスクです。,https://paperswithcode.com/task/depth-estimation
8,Instance Segmentation(インスタンスセグメンテーション),インスタンスセグメンテーションは、各オブジェクトの境界を検出したり、各オブジェクトに一意のラベルを割り当てるなど、画像内の個々のオブジェクトを識別および分離することを含むコンピュータービジョンタスクです。,https://paperswithcode.com/task/instance-segmentation
9,Image Generation(画像生成),ドラゴン,https://paperswithcode.com/task/image-generation
10,Question Answering(質問に答える),質問の回答は、質問に答えるタスク（通常は読解質問の質問）ですが、提供されたコンテキストに基づいて回答できない質問が提示された場合に棄権します。,https://paperswithcode.com/task/question-answering
11,Optical Character Recognition (OCR)(光学文字認識（OCR）),光学キャラクター認識または光学文字リーダー（OCR）は、スキャンされたドキュメント、ドキュメントの写真、シーンフォト（例えば、機械にエンコードされたテキストへのタイプ化された、手書きまたは印刷されたテキストの画像の電子的または機械的変換）です。,https://paperswithcode.com/task/optical-character-recognition
12,Image Captioning(画像キャプション),画像キャプションは、言葉で画像の内容を記述するタスクです。,https://paperswithcode.com/task/image-captioning
13,Domain Adaptation(ドメインの適応),ナンがあります,https://paperswithcode.com/methods/category/domain-adaptation
14,Person Re-Identification(人の再識別),人の再識別とは、ビデオまたは画像シーケンスのさまざまなカメラや場所で人の身元を一致させることを目標とするコンピュータービジョンタスクです。,https://paperswithcode.com/task/person-re-identification
15,Autonomous Driving(自律運転),自律運転は、人間の伝導なしで車両を運転するタスクです。,https://paperswithcode.com/task/autonomous-driving
16,Face Detection(顔検出),フェイス検出は、デジタル画像やビデオ内の人間の顔を自動的に識別して見つけることを伴うコンピュータービジョンタスクです。,https://paperswithcode.com/task/face-detection
17,2D Semantic Segmentation(2Dセマンティックセグメンテーション),このタスクには説明がありません！,https://paperswithcode.com/task/2d-semantic-segmentation
18,Fine-Grained Image Classification(細粒の画像分類),微調整された画像分類は、コンピュータービジョンのタスクであり、目標は画像をより大きなカテゴリ内のサブカテゴリに分類することです。,https://paperswithcode.com/task/fine-grained-image-classification
19,Image Super-Resolution(画像超解像度),画像の超解像度は、多くの場合、コンテンツと詳細を可能な限り維持しながら、多くの場合4倍以上の画像の解像度を増やすことを目標とする機械学習タスクです。,https://paperswithcode.com/task/image-super-resolution
20,Data Augmentation(データ増強),データ増強には、さまざまな変更に基づいてデータの量を増やすために使用される手法が含まれ、元のデータセットの例の量を拡大します。,https://paperswithcode.com/task/data-augmentation
21,Object Recognition(オブジェクト認識),オブジェクト認識は、画像やビデオのオブジェクトの分類を検出するためのコンピュータービジョン技術です。,https://paperswithcode.com/task/object-recognition
22,Action Recognition(アクション認識),アクション認識は、ビデオや画像の人間の行動を認識することを含むコンピュータービジョンタスクです。,https://paperswithcode.com/task/action-recognition-in-videos
23,Medical Image Segmentation(医療画像セグメンテーション),医療画像セグメンテーションは、医療画像を複数のセグメントに分割することを含むコンピュータービジョンタスクであり、各セグメントは画像の関心のある異なるオブジェクトまたは構造を表します。,https://paperswithcode.com/task/medical-image-segmentation
24,Visual Reasoning(視覚的な推論),視覚画像に関連する行動と推論を理解する能力,https://paperswithcode.com/task/visual-reasoning
25,Classification(分類),分類は、データのセットを事前定義されたクラスまたはグループに分類するタスクです。,https://paperswithcode.com/task/classification-1
26,Image-to-Image Translation(画像間翻訳),画像から画像への翻訳は、入力画像と出力イメージの間のマッピングを学習することを目標とするコンピュータービジョンと機械学習のタスクであり、出力画像を使用してスタイル転送などの特定のタスクを実行できるようにします。,https://paperswithcode.com/task/image-to-image-translation
27,Anomaly Detection(異常検出),異常検出は、データセット内の異常なパターンまたは予期しないパターンを識別するバイナリ分類であり、データの大部分から大幅に逸脱します。,https://paperswithcode.com/task/anomaly-detection
28,3D Human Pose Estimation(3Dヒューマンポーズ推定),3Dヒューマンポーズ推定は、2D画像またはビデオからの体調と骨の3D位置と方向を推定することを含むコンピュータービジョンタスクです。,https://paperswithcode.com/task/3d-human-pose-estimation
29,Scene Understanding(シーンの理解),シーンの理解は、シーンを理解するものです。,https://paperswithcode.com/task/scene-understanding
30,Unsupervised Domain Adaptation(監視されていないドメインの適応),監視されていないドメインの適応は、ソースドメインから学んだ知識を、多くの注釈付きトレーニングの例を使用して、標的ドメインのみをターゲットにしていないデータのみを導入するための学習フレームワークです。,https://paperswithcode.com/task/unsupervised-domain-adaptation
31,Facial Expression Recognition (FER)(表情表現認識（FER）),表情表現認識（FER）は、人間の顔に描かれた感情的な表現を特定して分類することを目的としたコンピュータービジョンタスクです。,https://paperswithcode.com/task/facial-expression-recognition
32,Handwriting Recognition(手書きの認識),画像ソース：ラベル付きデータがほとんどない履歴ドキュメントの手書き認識,https://paperswithcode.com/task/handwriting-recognition
33,Few-Shot Image Classification(少数のショット画像分類),少数のショット画像分類は、各カテゴリのいくつかのラベル付けされた例のみを使用して、画像を事前定義されたカテゴリに分類するための機械学習モデルをトレーニングすることを含むコンピュータービジョンタスクです（通常は6つの例）。,https://paperswithcode.com/task/few-shot-image-classification
34,Metric Learning(メトリック学習),メトリック学習の目標は、オブジェクトを埋め込み空間にマッピングする表現関数を学習することです。,https://paperswithcode.com/task/metric-learning
35,Object Tracking(オブジェクト追跡),オブジェクトトラッキングは、オブジェクト検出の初期セットを取得し、初期検出のそれぞれに一意のIDを作成し、ビデオ内のフレームを動き回ってID割り当てを維持しながら各オブジェクトを追跡するタスクです。,https://paperswithcode.com/task/object-tracking
36,2D object detection(2Dオブジェクト検出),このタスクには説明がありません！,https://paperswithcode.com/task/2d-object-detection
37,3D Pose Estimation(3Dポーズ推定),画像クレジット：GSNET：幾何学的およびシーン認識監督によるジョイントビークルのポーズと形状の再構築、ECCV'20,https://paperswithcode.com/task/3d-pose-estimation
38,Neural Architecture Search(ニューラルアーキテクチャ検索),ニューラルアーキテクチャ検索（NAS）は、小さなデータセットから大きなデータセットに転送できるモジュラーアーキテクチャを学習します。,https://paperswithcode.com/method/neural-architecture-search
39,3D Object Detection(3Dオブジェクト検出),3Dオブジェクトの検出は、コンピュータービジョンのタスクであり、目標は、その形状、場所、および向きに基づいて3D環境のオブジェクトを識別して見つけることです。,https://paperswithcode.com/task/3d-object-detection
40,3D Reconstruction(3D再構成),ナンがあります,https://paperswithcode.com/methods/category/3d-reconstruction
41,Few-Shot Learning(少数のショット学習),少数のショット学習は、メタトレーニング段階でいくつかの関連するタスクで学習者がトレーニングされているメタラーニングの例であり、メタ中に、わずかな例で目に見えない（ただし関連）タスクによく一般化できるようにします。,https://paperswithcode.com/task/few-shot-learning
42,Object Counting(オブジェクトカウント),オブジェクトカウントタスクの目標は、単一の画像またはビデオシーケンスでオブジェクトインスタンスの数をカウントすることです。,https://paperswithcode.com/task/object-counting
43,Image Clustering(画像クラスタリング),グラウンドトゥルースラベルにアクセスすることなく、データセットを意味的に意味のあるクラスターに分割するモデル。,https://paperswithcode.com/task/image-clustering
44,Zero-Shot Learning(ゼロショット学習),Zero-Shot Learning（ZSL）は、トレーニング中に見られなかったクラスを検出するモデルの能力です。,https://paperswithcode.com/task/zero-shot-learning
45,Face Anti-Spoofing(顔を引き起こします),顔のスプーフィングは、写真、ビデオ、マスク、または認可された人の顔の別の代替品を使用して、誤った顔の検証を防ぐタスクです。,https://paperswithcode.com/task/face-anti-spoofing
46,Image Inpainting(画像の入力),画像の開始は、画像内の欠落している領域を再構築するタスクです。,https://paperswithcode.com/task/image-inpainting
47,Novel View Synthesis(新規ビュー統合),指定されたソース画像とそのカメラポーズから任意のターゲットカメラのポーズでターゲット画像を合成します。,https://paperswithcode.com/task/novel-view-synthesis
48,Optical Flow Estimation(光フロー推定),光フロー推定は、画像またはビデオシーケンスでオブジェクトの動きを計算することを含むコンピュータービジョンタスクです。,https://paperswithcode.com/task/optical-flow-estimation
49,Panoptic Segmentation(パノプティックセグメンテーション),パノプティックセグメンテーションは、セマンティックセグメンテーションとインスタンスセグメンテーションを組み合わせて、シーンの包括的な理解を提供するコンピュータービジョンタスクです。,https://paperswithcode.com/task/panoptic-segmentation
50,Scene Text Recognition(シーンテキスト認識),このタスクのリーダーボードのシーンテキスト検出を参照してください。,https://paperswithcode.com/task/scene-text-recognition
51,Face Verification(顔の検証),顔の検証は、2つの顔の画像が同じ人に属しているかどうかを判断することを含む、コンピュータービジョンにおける機械学習タスクです。,https://paperswithcode.com/task/face-verification
52,Multi-Task Learning(マルチタスク学習),マルチタスク学習は、1つまたはすべてのタスクのパフォーマンスを最大化しながら、複数の異なるタスクを同時に学習することを目的としています。,https://paperswithcode.com/task/multi-task-learning
53,Continual Learning(継続的な学習),継続的な学習（増分学習、生涯学習とも呼ばれます）は、前のタスクから得られた知識を忘れずに、多数のタスクのモデルを順番に学習するための概念です。,https://paperswithcode.com/task/continual-learning
54,Cross-Modal Retrieval(クロスモーダル検索),クロスモーダル検索は、さまざまなモダリティにわたって検索タスクを実装するために使用されます。,https://paperswithcode.com/task/cross-modal-retrieval
55,Density Estimation(密度推定),密度推定の目標は、未知の密度の観測可能なデータセットの基礎となる確率密度分布の正確な説明を与えることです。,https://paperswithcode.com/task/density-estimation
56,Image Denoising(画像除去),画像除去は、画像からノイズを削除することを伴うコンピュータービジョンタスクです。,https://paperswithcode.com/task/image-denoising
57,Monocular Depth Estimation(単眼深度推定),単眼深度推定は、単一の（単眼の）RGB画像を与えられた各ピクセルの深さ値（カメラに対する距離）を推定するタスクです。,https://paperswithcode.com/task/monocular-depth-estimation
58,Multi-Label Classification(マルチラベル分類),マルチラベル分類は、インスタンスが複数のラベルに関連付けられる可能性のある監視された学習問題です。,https://paperswithcode.com/task/multi-label-classification
59,Object Localization(オブジェクトのローカリゼーション),オブジェクトのローカリゼーションは、通常、インスタンスを中心としたしっかりとトリミングされた境界ボックスを指定することにより、画像内の特定のオブジェクトカテゴリのインスタンスを見つけるタスクです。,https://paperswithcode.com/task/object-localization
60,Scene Recognition(シーン認識),このタスクには説明がありません！,https://paperswithcode.com/task/scene-recognition
61,Super-Resolution(超解像度),スーパー解像度は、低解像度の入力から欠落している高周波の詳細を生成することにより、画像またはビデオの解像度を増やすことを伴うコンピュータービジョンのタスクです。,https://paperswithcode.com/task/super-resolution
62,Visual Localization(視覚的なローカリゼーション),視覚的なローカリゼーションは、既知のシーンの視覚的表現と比較して、特定の画像のカメラポーズを推定する問題です。,https://paperswithcode.com/task/visual-localization
63,Visual Odometry(視覚臭),視覚的臭気は、視覚センサーによって収集されたデータを使用してロボットのポーズを推定することを中心的な目的とする情報融合の重要な領域です。,https://paperswithcode.com/task/visual-odometry
64,Disentanglement(解体),これは、主要な問題の基礎構造をその表現のばらばらの部分に解き放つ（または分離する）ことにより、データ効率的な方法で一連のタスクを解決するためのアプローチです。,https://paperswithcode.com/task/disentanglement
65,Domain Generalization(ドメイン一般化),ドメイン一般化のアイデアは、1つまたは複数のトレーニングドメインから学習し、目に見えないドメインに適用できるドメインに存在するモデルを抽出することです。,https://paperswithcode.com/task/domain-generalization
66,Face Alignment(顔のアライメント),顔のアライメントは、デジタル画像の面の幾何学的構造を識別し、翻訳、スケール、および回転に基づいて顔の標準的なアライメントを取得しようとするタスクです。,https://paperswithcode.com/task/face-alignment
67,Hand Pose Estimation(ハンドポーズの推定),ハンドポーズの推定は、ビデオフレームの画像またはセットから手の関節を見つけるタスクです。,https://paperswithcode.com/task/hand-pose-estimation
68,Salient Object Detection(顕著なオブジェクト検出),このタスクには説明がありません！,https://paperswithcode.com/task/salient-object-detection-1
69,2D Human Pose Estimation(2Dヒューマンポーズ推定),人間のポーズ推定とは何ですか？,https://paperswithcode.com/task/2d-human-pose-estimation
70,Crowd Counting(群衆の数),群衆のカウントは、イメージの人々を数えるタスクです。,https://paperswithcode.com/task/crowd-counting
71,Facial Landmark Detection(顔のランドマーク検出),フェイシャルランドマークの検出は、目、鼻、口、あごなどの顔の特定のポイントまたはランドマークを検出およびローカライズすることを含むコンピュータービジョンタスクです。,https://paperswithcode.com/task/facial-landmark-detection
72,Lesion Segmentation(病変セグメンテーション),病変セグメンテーションは、医療ベースの画像の他のオブジェクトから病変を分割するタスクです。,https://paperswithcode.com/task/lesion-segmentation
73,Long-tail Learning(ロングテール学習),視覚的認識で最も困難な問題の1つであるロングテールの学習は、長期にわたるクラスの分布に続く多数の画像から、パフォーマンスの良いモデルを訓練することを目指しています。,https://paperswithcode.com/task/long-tail-learning
74,Pedestrian Detection(歩行者の検出),歩行者の検出は、カメラから歩行者を検出するタスクです。,https://paperswithcode.com/task/pedestrian-detection
75,Quantization(量子化),量子化は、ニューラルネットワークトレーニングの計算コストを削減するための有望な手法であり、高コストの浮動小数点数（たとえば、FLOAT32）を低コストの固定点数（例：INT8に置き換えることができます,https://paperswithcode.com/task/quantization
76,Saliency Detection(顕著性検出),顕著性検出は、画像内の顕著なオブジェクトを見つけることを目的とするコンピュータービジョンの前処理ステップです。,https://paperswithcode.com/task/saliency-detection
77,Self-Supervised Learning(自己教師の学習),自己教師の学習とは、自己教師の方法で表現を学習する方法のカテゴリーを指します（つまり、ラベルなし）。,https://paperswithcode.com/methods/category/self-supervised-learning
78,Semi-Supervised Image Classification(半教師の画像分類),半学者の画像分類は、分類されたデータと分類パフォーマンスを向上させるためにラベル付けされたデータとラベル付けされたデータをレバレッジします。,https://paperswithcode.com/task/semi-supervised-image-classification
79,Stereo Matching(ステレオマッチング),ステレオマッチングは、2D画像から実世界の3D構造を回復するコンピュータービジョンのコアテクノロジーの1つです。,https://paperswithcode.com/task/stereo-matching-1
80,Video Prediction(ビデオ予測),ビデオ予測は、過去のビデオフレームが与えられた将来のフレームを予測するタスクです。,https://paperswithcode.com/task/video-prediction
81,Visual Object Tracking(視覚的なオブジェクト追跡),視覚オブジェクト追跡は、コンピュータービジョン、画像理解、パターン認識における重要な研究トピックです。,https://paperswithcode.com/task/visual-object-tracking
82,Age Estimation(年齢の推定),年齢の推定は、画像から人の年齢を他の種類のデータから推定するタスクです。,https://paperswithcode.com/task/age-estimation
83,Autonomous Vehicles(自動運転車),自動運転車は、人間の伝導なしで自分自身を導くことができる車両を作るタスクです。,https://paperswithcode.com/task/autonomous-vehicles
84,Denoising(除去),除去は、画像処理とコンピュータービジョンのタスクであり、画像からノイズを削除または削減することを目的としています。,https://paperswithcode.com/task/denoising
85,Human-Object Interaction Detection(ヒトとオブジェクトの相互作用検出),ヒトとオブジェクトの相互作用（HOI）検出は、イメージの「相互作用のセット」を識別するタスクです。,https://paperswithcode.com/task/human-object-interaction-detection
86,Image Segmentation(画像セグメンテーション),画像セグメンテーションは、画像を複数のセグメントまたは領域に分割することを含むコンピュータービジョンタスクであり、それぞれが異なるオブジェクトまたはオブジェクトの一部に対応します。,https://paperswithcode.com/task/image-segmentation
87,Scene Classification(シーン分類),シーン分類は、写真のシーンがカテゴリー的に分類されるタスクです。,https://paperswithcode.com/task/scene-classification
88,Simultaneous Localization and Mapping(同時ローカリゼーションとマッピング),同時ローカリゼーションとマッピング（SLAM）は、不明な環境のマップを構築または更新しながら、同時にその中のエージェントの位置を追跡するタスクです。,https://paperswithcode.com/task/simultaneous-localization-and-mapping
89,Skeleton Based Action Recognition(スケルトンベースのアクション認識),スケルトンベースのアクション認識は、Microsoft Kinect、Intel RealSense、ウェアラブルデバイスなどのセンサーからキャプチャされた一連の3D骨格ジョイントデータから人間のアクションを認識することを含むコンピュータービジョンタスクです。,https://paperswithcode.com/task/skeleton-based-action-recognition
90,Trajectory Prediction(軌跡予測),軌道予測は、車、バス、歩行者、人力車、動物などのさまざまな道路材の短期（1〜3秒）および長期（3〜5秒）の空間座標を予測する問題です。,https://paperswithcode.com/task/trajectory-prediction
92,3D Hand Pose Estimation(3Dハンドポーズ推定),画像：Zimmerman et l,https://paperswithcode.com/task/3d-hand-pose-estimation
93,Common Sense Reasoning(常識推論),常識推論タスクは、モデルがパターン認識を超えることを要求することを目的としています。,https://paperswithcode.com/task/common-sense-reasoning
94,Gaze Estimation(視線の推定),視線の推定は、人の顔を与えられた人がどこを見ているかを予測するタスクです。,https://paperswithcode.com/task/gaze-estimation
95,Image Compression(画像圧縮),画像圧縮は、デジタル画像のデータ圧縮のアプリケーションであり、ストレージを下げ、,https://paperswithcode.com/task/image-compression
